2016,I,1,Impuestos directos
2016,I,2,Impuestos indirectos
2016,I,3,"Tasas, precios públicos y otros ingresos"
2016,I,4,Transferencias corrientes
2016,I,5,Ingresos patrimoniales
2016,I,6,Enajenacions de inversiones reales
2016,I,7,Transferencias de capital
2016,I,8,Activos financieros
2016,I,9,Pasivos financieros
2016,I,3,"Tasas, precios públicos y otros ingresos"
2016,I,4,Transferencias corrientes
2016,I,5,Ingresos patrimoniales
2016,I,7,Transferencias de capital
2016,I,3,"Tasas, precios públicos y otros ingresos"
2016,I,4,Transferencias corrientes
2016,I,5,Ingresos patrimoniales
2016,I,7,Transferencias de capital
2016,I,10,Sobre la renta
2016,I,11,Sobre el capital
2016,I,20,Sobre transmisiones patrimoniales y actos jurídicos documentados
2016,I,21,Sobre el valor añadido
2016,I,22,Sobre consumos específicos
2016,I,28,Otros impuestos indirectos
2016,I,30,Tasas
2016,I,32,Otros ingresos procedentes de la prestación de servicios
2016,I,33,Venta de bienes
2016,I,38,Reintegros de operaciones corrientes
2016,I,39,Otros ingresos
2016,I,40,Del Estado
2016,I,49,Del exterior
2016,I,51,Intereses de anticipos y préstamos concedidos
2016,I,52,Intereses de depósitos
2016,I,54,Rentas de bienes inmuebles
2016,I,55,Productos de concesiones y aprovechamientos especiales
2016,I,59,Otros ingresos patrimoniales
2016,I,61,Enajenación de las demás inversiones
2016,I,68,Reintegros por operaciones de capital
2016,I,70,Del Estado
2016,I,74,De empresas públicas y otros entes públicos de la Comunidad Autónoma IB
2016,I,79,Del exterior
2016,I,82,Reintegros de préstamos concedidos al sector púlico
2016,I,87,Remanentes de tesorería
2016,I,91,Préstamos recibidos en euros
2016,I,33,Venta de bienes
2016,I,38,Reintegros de operaciones corrientes
2016,I,45,De comunidades autónomas
2016,I,52,Intereses de depósitos
2016,I,75,De comunidades autónomas
2016,I,30,Tasas
2016,I,31,Precios públicos
2016,I,32,Otros ingresos procedentes de la prestación de servicios
2016,I,33,Venta de bienes
2016,I,38,Reintegros de operaciones corrientes
2016,I,39,Otros ingresos
2016,I,45,De comunidades autónomas
2016,I,47,De empresas privadas
2016,I,52,Intereses de depósitos
2016,I,55,Productos de concesiones y aprovechamientos especiales
2016,I,75,De comunidades autónomas
2016,I,100,Impuesto sobre la renta de las personas físicas
2016,I,110,Impuesto general sobre sucesiones y donaciones
2016,I,111,Impuesto sobre el patrimonio de las personas físicas
2016,I,112,Impuesto sobre depósitos en entidades bancariuas
2016,I,200,Impuesto sobre transmisiones intervivos
2016,I,201,Impuesto sobre actos jurídicos documentados
2016,I,210,Impuesto sobre el valor añadido
2016,I,220,Impuestos especiales
2016,I,283,Canon de depuración de agüas
2016,I,300,Tasas de juego
2016,I,301,Tasas y cánones de la ordenación de las telecomunicaciones
2016,I,303,"Tasas académicas, derechos de matrícula, expedición de títulos y otros similares"
2016,I,309,Otras tasas
2016,I,329,Otros ingresos procedentes de la prestación de servicios
2016,I,330,Venta de publicaciones propias
2016,I,332,Venta de fotocopias y otros productos de reprografía
2016,I,333,Venta de medicamentos
2016,I,339,Venta de otros bienes
2016,I,380,Reintegros de ejercicios cerrados
2016,I,381,Reintegros del presupuesto corriente
2016,I,391,Recargos y multas
2016,I,399,Ingresos diversos
2016,I,400,De la Administración General
2016,I,401,De organismos autónomos
2016,I,402,De la Seguridad Social
2016,I,490,Del Fondo Social Europeo
2016,I,492,Otras transferencias de la UE
2016,I,514,A empresas públicas y a otros entes públicos
2016,I,520,Intereses de cuentas bancarias
2016,I,540,Alquileres y productos de inmuebles
2016,I,549,Otras rentas de bienes inmuebles
2016,I,550,Productos de concesiones administrativas
2016,I,559,Otras concesiones y aprovechamientos
2016,I,599,Otros ingresos patrimoniales
2016,I,619,Venta de otras inversiones reales
2016,I,680,Reintegros de ejercicios cerrados
2016,I,700,De la Administración General
2016,I,701,De organismos autónomos
2016,I,743,De consorcios en que participa la Comunidad Autónoma IB
2016,I,790,Del Fondo Europeo de Desarrollo Regional
2016,I,821,A largo plazo
2016,I,870,Remanente de tesoreria
2016,I,911,A largo plazo de entes del sector público
2016,I,339,Venta de otros bienes
2016,I,381,Reintegros del presupuesto corriente
2016,I,450,De la Comunidad Autónoma IB
2016,I,520,Intereses de cuentas bancarias
2016,I,750,De la Comunidad Autónoma IB
2016,I,303,"Tasas académicas, derechos de matrícula, expedición de títulos y otros similares"
2016,I,319,Otros precios públicos
2016,I,327,Otros ingresos procedentes de la prestación de servicios de asistencia sanitaria
2016,I,333,Venta de medicamentos
2016,I,380,Reintegros de ejercicios cerrados
2016,I,381,Reintegros del presupuesto corriente
2016,I,391,Recargos y multas
2016,I,399,Ingresos diversos
2016,I,450,De la Comunidad Autónoma IB
2016,I,470,De empresas privadas
2016,I,520,Intereses de cuentas bancarias
2016,I,550,Productos de concesiones administrativas
2016,I,750,De la Comunidad Autónoma IB
2016,I,10000,"Impuesto sobre la renta de las personas físicas, tarifa autonòmica"
2016,I,11000,Impuesto general sobre sucesiones y donaciones
2016,I,11100,Impuesto extraordinario sobre el patrimonio de las personas físicas
2016,I,11200,Impuesto sobre depósitos en entidades de crédito
2016,I,20000,Impuesto sobre transmisiones inter-vivos
2016,I,20001,"Impuesto sobre transmisiones inter-vivos, timbres"
2016,I,20100,Impuesto sobre actos jurídicos documentados
2016,I,20101,"Impuesto sobre actos jurídicos documentados, timbres"
2016,I,21000,Impuesto sobre el valor añadido
2016,I,22001,Impuesto especial sobre la cerveza
2016,I,22003,Impuesto especial sobre el alcohol y bebidas derivadas
2016,I,22004,Impuesto especial sobre las labores del tabaco
2016,I,22005,Impuesto especial sobre los hidrocarburos
2016,I,22006,Impuesto especial sobre determinados medios de transporte
2016,I,22007,Impuesto especial sobre productos intermedios
2016,I,22008,"Impuesto especial sobre la venta minorista de determinados hidrocarburos, tramo autonómico"
2016,I,22009,Impuesto especial sobre la electricidad
2016,I,22010,Impuesto sobre estancias en empresas turísticas de alojamiento
2016,I,28300,Canon de saneamiento/depuración de aguas
2016,I,30000,Tasas de juego
2016,I,30001,"Tasas por servicios administrativos en materia de casinos, juegos y apuestas"
2016,I,30101,Autorizaciones/certificaciones relacionadas con la radiodifusión sonora a través de ondas métricas con MF
2016,I,30301,"Servicios docentes, Conservatorio Profesional de Música y Danza de las IB"
2016,I,30302,"Servicios docentes, Escuelas Oficiales de Idiomas"
2016,I,30303,"Servicios docentes, ES de Diseño y de Conservación y Restauración de Bienes Culturales de las IB"
2016,I,30304,"Derechos de matrícula, pruebas de evaluación y acreditación de conocimiento del catalán"
2016,I,30305,Expedición de títulos académicos y profesionales
2016,I,30306,Matrícula/inscripción a las pruebas selectivas para el acceso a los cuerpos docentes
2016,I,30307,Matrícula/inscripción a las pruebas selectivas para el acceso a la Administración de la Comunitat Autónoma IB
2016,I,30308,Matrícula/inscripción a los cursos programados por la Escuela Balear de Administración Pública
2016,I,30309,Expedición de títulos i compulsa de documentos expedidos por la Escuela Balear de Administración Pública
2016,I,30310,Matrícula/inscripción a las pruebas para la verificación de la capacidad profesional de los transportistas y …
2016,I,30311,Servicios de reconocimiento de la capacidad para el ejercicio de actividades náuticas recreativas
2016,I,30314,Servicios de reconocimiento de la capacitación náutico pesquera y de buceo profesional
2016,I,30315,Matrícula/inscripción a las pruebas de guías turísticos de la Comunitat Autónoma IB
2016,I,30317,"Servicios docentes, enseñanzas deportivas del sistema educativo"
2016,I,30318,Matrícula/inscripción a las pruebas de acceso a los ciclos formativos
2016,I,30320,Reconocimiento de la competencia profesional adquirida a través de la experiencia laboral en las IB
2016,I,30901,Actuaciones del Registro de Entidades Jurídicas
2016,I,30902,Apertura de establecimientos turísticos y otras autorizaciones administrativas
2016,I,30904,"Fotocopias, copias y expedición de certificados"
2016,I,30905,Compulsa y autentificación de documentos
2016,I,30907,"Servicios del laboratorio de la atmósfera, certificados de emisiones y suministro de datos de la atmósfera"
2016,I,30908,Informes de evaluación de impacto ambiental
2016,I,30909,Servicios facultativos en materia de medio ambiente
2016,I,30910,Servicios y actividades en zonas de servitud de protección y tránsito portuario
2016,I,30917,Concesión de autorizaciones en zonas de dominio público hidráulico y de policía de canales
2016,I,30919,Autorización de concesiones para el vertido de aguas residuales
2016,I,30930,Control de seguridad alimentaria
2016,I,30931,Control de animales
2016,I,30932,Control de sajnidat ambiental
2016,I,30943,Servicios administrativos generales en materia de transportes
2016,I,30944,Autorizaciones de transporte por carretera y de actividades auxiliares y complementarias del transporte
2016,I,30946,Servicios y actuaciones en materia de arquitectura y vivienda
2016,I,30947,"Comprobación, reconocimiento y acreditación de la capacidad para el alquiler de embarcaciones de recreo"
2016,I,30948,Autorizaciones para el ejercicio de la actividad de escuelas nauticodeportivas y de centros lucrativos de actividades sub acuática
2016,I,30950,Tramitación de autorizaciones administrativas y de comprobación técnico sanitaria
2016,I,30951,Inscripciones y anotaciones en el Registro Sanitario
2016,I,30952,"Tramitación de autorizaciones administrativas en los centros, establecimientos y servicios sanitarios"
2016,I,30954,Control sanitario de las condiciones de la piscinas de uso público
2016,I,30956,Control de las condicione sanitarias de los establecimientos que elaboran o sirven comidas preparadas
2016,I,30957,"Autorizaciones para la instalación, traslado o transmisión de oficinas de farmacia"
2016,I,30958,Otras actuaciones sanitarias
2016,I,30959,Servicios del laboratorio de salud pública
2016,I,30960,Realización de ensayos clínicos con medicamentos
2016,I,30966,Licencias de pesca
2016,I,30967,Celebración de campeonatos de pesca
2016,I,30968,"Ordenación y defensa de las industrias agrícolas, forestales y pecuarias"
2016,I,30969,Servicios de gestión técnico facultativa de los servicios agronómicos
2016,I,30971,Servicios de gestión técnico facultativa de los servicios agronómicos
2016,I,30973,Servicios administrativos
2016,I,30974,Licencia autonómica de gran establecimiento comercial
2016,I,30979,Inscripción en los registros de emergencias
2016,I,30980,Autorización de entidades formadoras
2016,I,30981,Declaración de interés sanitario
2016,I,30982,Registro de entidades formadoras de manipuladores de alimentos
2016,I,30983,Registro de actividades de carnicería y charcutería
2016,I,30985,Registro de entidades formadoras para el uso de desfibriladores
2016,I,30986,Inscripción de empresas de servicios de biocidas y plaguicidas
2016,I,30987,Supervisión de las instalaciones de agua para el consumo humano
2016,I,30990,Revisión del grado de dependencia
2016,I,30991,Registro de parejas estables
2016,I,30992,Servicios administrativos generales del Servicio de Empleo de las IB
2016,I,30993,Actuaciones administrativas en espàcios silvestres
2016,I,30994,Autorizaciones para trabajos subacuáticos
2016,I,30995,Autorización de cambio de puerto base i uso temporal
2016,I,30996,Expedición de certificado de profesionalidad pesquera
2016,I,30997,Acreditación de actividades de formación para profesiones sanitarias
2016,I,30999,Otras tasas
2016,I,32920,"Entradas a museos, exposiciones, espectáculos, …"
2016,I,32930,"Derechos de alojamiento, restauración y residencia"
2016,I,32999,Otros ingresos procedentes de la prestación de servicios
2016,I,33001,"Venta, publicación y anuncios del BOIB"
2016,I,33099,Venta de otras publicaciones propias
2016,I,33200,Venta de fotocopias y de otros productos de reprografía
2016,I,33300,Venta de medicamentos
2016,I,33900,Venta de otros bienes
2016,I,33901,Venta de impresos
2016,I,38000,Reintegros de ejercicios cerrados
2016,I,38100,Reintegros del presupuesto corriente
2016,I,38101,Reintegros de remanentes de pagos a justificar
2016,I,39100,Recargos de apremio
2016,I,39101,Intereses de demora
2016,I,39102,Multas y sanciones
2016,I,39901,Recursos eventuales
2016,I,39905,Ingresos por costas procesales
2016,I,39999,Otros ingresos diversos
2016,I,40000,De la Administración General
2016,I,40001,Fondo de garantía
2016,I,40002,Fondo de suficiencia
2016,I,40008,Anticipos a cuenta por aplazamiento devolución de liquidaciones negativas
2016,I,40009,Liquidación de ejercicios anteriores
2016,I,40100,De organismos autónomos de carácter administrativo
2016,I,40101,Del Servicio Público de Empleo INEM
2016,I,40201,Del Instituto de Migración y Servicios Sociales IMSERSO
2016,I,40260,Programa de ahorro en incapacidad temporal IT
2016,I,40261,Asistencia a residentes extranjeros
2016,I,49000,Del Fondo Social Europeo
2016,I,49200,Otras transferencias de la UE
2016,I,51400,A empresas públicas y a otros entes públicos
2016,I,52099,Otros intereses de cuentas bancarias
2016,I,54002,Alquileres de edificios en general
2016,I,54900,Otras rentas de bienes inmuebles
2016,I,55000,Productos de concesiones administrativas
2016,I,55900,Otras concesiones y aprovechamientos
2016,I,59900,Otros ingresos patrimoniales
2016,I,61900,Enajenación de otras inversiones reales
2016,I,68000,Reintegros de ejercicios cerrados
2016,I,70000,De la Administración General
2016,I,70100,De organismos autónomos de carácter administrativo
2016,I,70101,Del Servicio Público de Empleo INEM
2016,I,74300,De consorcios participados por la Comunitat Autónoma IB
2016,I,79000,Del Fondo Europeo de Desarrollo Regional FEDER
2016,I,82104,A empresas públicas y otros entes públicos
2016,I,87001,"Remanentes de tesorería, financiación de incorporaciones de crédito"
2016,I,87002,"Remanentes de tesorería, financiación de ampliaciones de crédito"
2016,I,91100,A largo plazo de entes del sector público
2016,I,33901,Venta de impresos
2016,I,38100,Reintegros del presupuesto corriente
2016,I,45000,De la Comunidad Autónoma IB
2016,I,52099,Otros intereses de cuentas bancarias
2016,I,75000,De la Comunidad Autónoma IB
2016,I,30307,Matrícula/inscripción a las pruebas selectivas para el acceso a la Administración de la Comunitat Autónoma IB
2016,I,31901,"Asistencia sanitaria, aseguradoras privadas"
2016,I,31902,"Asistencia sanitaria, particulares"
2016,I,31903,"Asistencia sanitaria, accidentes de trabajo"
2016,I,31904,"Asistencia sanitaria, accidentes de tránsito/tráfico UNESPA"
2016,I,31908,"Asistencia sanitaria, mutuas de seguros escolares y deportivas"
2016,I,31910,"Asistencia sanitaria, otros entes y organismos públicos"
2016,I,31917,"Asistencia sanitaria, accidentes de tránsito/tráfico"
2016,I,31918,"Asistencia sanitaria, cuotas por convenios especiales de asistencia sanitaria"
2016,I,32700,Otros ingresos procedentes de la prestación de servicios de asistencia sanitaria
2016,I,32704,"Asistencia sanitaria, empresa colaboradoras de la Seguridad Social"
2016,I,33300,Venta de medicamentos
2016,I,38000,Reintegros de ejercicios cerrados
2016,I,38100,Reintegros del presupuesto corriente
2016,I,38101,Reintegros de remanentes de pagos a justificar
2016,I,39100,Recargos de apremio
2016,I,39101,Intereses de demora
2016,I,39996,Ingresos por anuncios de concursos
2016,I,39998,Ingresos por resoluciones judiciales
2016,I,39999,Otros ingresos diversos
2016,I,45000,De la Comunidad Autónoma IB
2016,I,45001,"De la Comunitat Autónoma IB, asistencia a desplazados"
2016,I,45002,"De la Comunitat Autónoma IB, programa de ahorro en incapacidad temporal IT"
2016,I,47000,De empresas privadas
2016,I,52099,Otros intereses de cuentas bancarias
2016,I,55000,Productos de concesiones administrativas
2016,I,55001,"Ingresos de cafeterías, librerías y aparatos de TV"
2016,I,75000,De la Comunidad Autónoma IB
2016,G,1,Gastos de personal
2016,G,2,Gastos corrientes en bienes y servicios
2016,G,3,Gastos financieros
2016,G,4,Transferencias corrientes
2016,G,5,Fondo de contingencia
2016,G,6,Inversiones reales
2016,G,7,Transferencias de capital
2016,G,8,Activos financieros
2016,G,9,Pasivos financieros
2016,G,1,Gastos de personal
2016,G,2,Gastos corrientes en bienes y servicios
2016,G,3,Gastos financieros
2016,G,6,Inversiones reales
2016,G,1,Gastos de personal
2016,G,2,Gastos corrientes en bienes y servicios
2016,G,3,Gastos financieros
2016,G,4,Transferencias corrientes
2016,G,6,Inversiones reales
2016,G,9,Pasivos financieros
2016,G,10,Retribuciones de altos cargos
2016,G,11,Retribuciones del personal eventual
2016,G,12,Retribuciones de los funcionarios y del personal estatutario
2016,G,13,Retribuciones del personal laboral
2016,G,14,Otro personal
2016,G,15,Incentivos al rendimiento
2016,G,16,"Cuotas, prestaciones y gastos sociales a cargo de la empresa"
2016,G,20,Arrendamientos y cánones
2016,G,21,"Reparaciones, mantenimiento y conservación"
2016,G,22,"Material, suministros y otros"
2016,G,23,Indemnizaciones por razón del servicio
2016,G,24,Dotación para servicios nuevos
2016,G,26,Conciertos para la prestación de servicios sociales
2016,G,30,De deuda pública en euros
2016,G,31,De préstamos en euros
2016,G,35,Intereses de demora y otros gastos financieros
2016,G,40,Al Estado
2016,G,42,Al Servicio de Salud de las IB
2016,G,44,Al sector público instrumental y a otros enstes del sectro público de la CAIB
2016,G,45,A comunidades autónomas
2016,G,46,A corporaciones locales
2016,G,47,A empresas privadas
2016,G,48,A familias e instituciones sin finalidad lucrativa
2016,G,49,Al exterior
2016,G,50,Fondo de contingencia
2016,G,60,Inversión nueva en infraestructura y bienes destinados al uso general
2016,G,61,Inversión de reposición  en infraestructura y bienes destinados al uso general
2016,G,62,Inversión nueva asociada al funcionamiento operativo de los servicios
2016,G,63,Inversión de reposición asociada al funcionamiento operativo de los servicios
2016,G,64,Gastos en inversión de carácter inmaterial
2016,G,70,Al Estado
2016,G,72,AL Servicio de Salud de las IB
2016,G,74,Al sector público instrumental y a otros enstes del sectro público de la CAIB
2016,G,76,A corporaciones locales
2016,G,77,A empresas privadas
2016,G,78,A familias e instituciones sin finalidad lucrativa
2016,G,82,Concesión de préstamos al sector público
2016,G,83,Concesión de préstamos fuera del sector público
2016,G,91,Amortización de préstamos en euros
2016,G,10,Retribuciones de altos cargos
2016,G,12,Retribuciones de los funcionarios y del personal estatutario
2016,G,13,Retribuciones del personal laboral
2016,G,15,Incentivos al rendimiento
2016,G,16,"Cuotas, prestaciones y gastos sociales a cargo de la empresa"
2016,G,20,Arrendamientos y cánones
2016,G,21,"Reparaciones, mantenimiento y conservación"
2016,G,22,"Material, suministros y otros"
2016,G,23,Indemnizaciones por razón del servicio
2016,G,31,De préstamos en euros
2016,G,62,Inversión nueva asociada al funcionamiento operativo de los servicios
2016,G,64,Gastos en inversión de carácter inmaterial
2016,G,10,Retribuciones de altos cargos
2016,G,12,Retribuciones de los funcionarios y del personal estatutario
2016,G,13,Retribuciones del personal laboral
2016,G,14,Otro personal
2016,G,15,Incentivos al rendimiento
2016,G,16,"Cuotas, prestaciones y gastos sociales a cargo de la empresa"
2016,G,20,Arrendamientos y cánones
2016,G,21,"Reparaciones, mantenimiento y conservación"
2016,G,22,"Material, suministros y otros"
2016,G,23,Indemnizaciones por razón del servicio
2016,G,25,Asistencia sanitaria con medios ajenos
2016,G,31,De préstamos en euros
2016,G,35,Intereses de demora y otros gastos financieros
2016,G,48,A familias e instituciones sin finalidad lucrativa
2016,G,62,Inversión nueva asociada al funcionamiento operativo de los servicios
2016,G,63,Inversión de reposición asociada al funcionamiento operativo de los servicios
2016,G,64,Gastos en inversión de carácter inmaterial
2016,G,91,Amortización de préstamos en euros
2016,G,100,Retribuciones básicas y otras remuneraciones
2016,G,110,Retribuciones básicas y otras remuneraciones
2016,G,120,Retribuciones básicas de funcionarios y personal estatutario
2016,G,121,Retribuciones complementarias de funcionarios y personal estatutario
2016,G,126,Retribuciones de funcionarios interinos
2016,G,130,Laboral fijo
2016,G,131,Laboral temporal
2016,G,141,Retribuciones de otro personal
2016,G,150,Productividad
2016,G,151,Gratificaciones
2016,G,160,Cuotas sociales
2016,G,162,Gastos sociales a favor de funcionarios y personal no laboral
2016,G,163,Gastos sociales a favor del personal laboral
2016,G,200,Arrendamientos de terrenos y bienes naturales
2016,G,202,Arrendamientos de edificios y otras construcciones
2016,G,203,"Arrendamientos de maquinaria, instalaciones y utillaje"
2016,G,204,Arrendamientos de material de transporte
2016,G,205,Arrendamientos de mobiliario y enseres
2016,G,206,Arrendamientos de equipos para procesos de la información
2016,G,208,Arrendamientos de otro inmovilizado material
2016,G,209,Cánones
2016,G,212,De edificios y otras construcciones
2016,G,213,"De maquinaria, instalaciones y utillaje"
2016,G,214,De medios de transporte
2016,G,215,De mobiliario y enseres
2016,G,216,De equipos para procesos de la información
2016,G,219,De otro inmovilizado material
2016,G,220,Material de oficina
2016,G,221,Suministros
2016,G,222,Comunicaciones
2016,G,223,Transportes
2016,G,224,Primas de seguros
2016,G,225,Tributos
2016,G,226,Gastos diversos
2016,G,227,Trabajos realizados por otras empresas y profesionales independientes
2016,G,229,Gasto de funcionamiento de centros escolares
2016,G,230,"Dietas, locomoción y traslados"
2016,G,231,Asistencias y pernoctas
2016,G,239,Otras indemnizaciones
2016,G,240,Dotación para servicios nuevos
2016,G,261,"Conciertos con instituciones, prestación de servicios sociales"
2016,G,300,Intereses
2016,G,309,Otros gastos financieros
2016,G,310,Intereses
2016,G,319,Otros gastos financieros
2016,G,352,Intereses de demora
2016,G,359,Otros gastos financieros
2016,G,400,A la Administración General
2016,G,401,A organismos autónomos
2016,G,402,A la Seguridad Social
2016,G,404,"A sociedades mercantiles estatales, entidades empresarial y otros entes públicos"
2016,G,420,Al Servicio de Salud de las IB
2016,G,440,A sociedades mercantiles públicas
2016,G,441,A entidades públicas empresariales y a otros entes públicos
2016,G,443,A consorcios participados por la CAIB
2016,G,444,A fundaciones del sector público autonómico
2016,G,445,A otras fundaciones participadas por la CAIB
2016,G,451,A otras comunidades autónomas
2016,G,460,A ayuntamientos
2016,G,461,A consejos insulares
2016,G,464,A empresas públicas y a otros entes públicos de corporaciones locales
2016,G,469,A otros entes territoriales
2016,G,470,A empresas privadas
2016,G,480,A familias e instituciones sin fines de lucro
2016,G,481,A centros de enseñanza concertados
2016,G,490,Al exterior
2016,G,500,Fondo de contingencia
2016,G,600,Terrenos y bienes naturales
2016,G,601,Infraestructura y bienes destinados al uso general
2016,G,608,"Bienes del patrimonio histórico, artístico y cultural"
2016,G,611,Infraestructuras y bienes destinados al uso general
2016,G,618,"Bienes del patrimonio histórico, artístico y cultural"
2016,G,622,Edificios y otras construcciones
2016,G,623,"Maquinaria, instalaciones y utillaje"
2016,G,624,Elementos de transporte
2016,G,625,Mobiliario y enseres
2016,G,626,Equipos para procesos de la información
2016,G,629,Otro inmovilizado materia
2016,G,632,Edificios y otras construcciones
2016,G,633,"Maquinaria, instalaciones y utillaje"
2016,G,634,Elementos de transporte
2016,G,635,Mobiliario y enseres
2016,G,636,Equipos para procesos de la información
2016,G,639,Otro inmovilizado material
2016,G,640,Gastos en inversiones de carácter inmaterial
2016,G,700,A la Administración General
2016,G,701,A organismos autónomos
2016,G,720,Al Servicio de Salud de las IB
2016,G,740,A sociedades mercantiles públicas
2016,G,741,A entidades públicas empresariales y a otros entes públicos
2016,G,742,A empresas vinculadas a la Comunidad Autónoma IB
2016,G,743,A consorcios participados por la Comunidad Autònoma IB
2016,G,744,A fundaciones del sector público autonómico
2016,G,745,A otras fundaciones participadas por la CAIB
2016,G,760,A ayuntamientos
2016,G,761,A consejos insulares
2016,G,764,A empresas públicas y a otros entes públicos de corporaciones locales
2016,G,770,A empresas privadas
2016,G,780,A familias e instituciones sin fines de lucro
2016,G,820,Concesión de préstamos al sector público a corto plazo
2016,G,821,Concesión de préstamos al sector público a largo plazo
2016,G,830,Concesión de préstamos fuera del sector público  corto plazo
2016,G,831,Concesión de préstamos fuera del sector publico a largo plazo
2016,G,913,Amortización de préstamos recibidos a largo plazo de entes de fuera del sector público
2016,G,100,Retribuciones básicas y otras remuneraciones
2016,G,120,Retribuciones básicas de funcionarios y personal estatutario
2016,G,121,Retribuciones complementarias de funcionarios y personal estatutario
2016,G,130,Laboral fijo
2016,G,131,Laboral temporal
2016,G,151,Gratificaciones
2016,G,160,Cuotas sociales
2016,G,162,Gastos sociales a favor de funcionarios y personal no laboral
2016,G,163,Gastos sociales a favor del personal laboral
2016,G,202,Arrendamientos de edificios y otras construcciones
2016,G,204,Arrendamientos de material de transporte
