2016,0,Deuda pública
2016,1,Funcionamiento institucional y administración general
2016,2,Servicios públicos generales
2016,3,"Seguridad, protección y promoción social"
2016,4,Producción de bienes públicos de carácter social
2016,5,Producción de bienes públicos de carácter económico
2016,7,Fomento y regulación de sectores productivos
2016,8,Fondo de contingencia
2016,9,Apoyo financieror a otras administraciones públicas
2016,01,Deuda pública
2016,11,Alta dirección de la Comunidad Autónoma y del Gobierno
2016,12,Administración y servicios generales
2016,13,Relaciones institucionales y procesos electorales
2016,14,Regulación económica
2016,15,"Transparencia, comunicación y participación"
2016,21,Justicia
2016,22,Seguridad y protección civil
2016,23,Relaciones exteriores y cooperación al desarrollo
2016,31,Seguridad y protección social
2016,32,Promoción social
2016,41,Sanidad
2016,42,Educación
2016,43,Vivienda y urbanismo
2016,44,Consumo
2016,45,Cultura
2016,46,Deportes
2016,51,Infraestructuras básicas y transportes
2016,52,Transporte
2016,53,Ordenación del territorio y urbanismo
2016,54,"Investigación científica, técnica y aplicada"
2016,55,Sociedad de la información y el conocimiento y telecomunicaciones
2016,56,Ciclo del agua
2016,57,Actuaciones ambientales
2016,58,Infraestructuras agrarias y rurales
2016,59,Otras actuaciones de carácter económico
2016,71,"Agricultura, ganadería y pesca"
2016,72,Industria
2016,73,Energía
2016,74,Minería
2016,75,Turismo
2016,76,Comercio
2016,81,Fondo de contingencia
2016,91,Apoyo financiero a administraciones públicas territoriales
2016,011,Deuda pública
2016,111,Alta dirección de la Comunidad Autónoma
2016,121,Servicios generales y función pública
2016,126,Otros servicios generales
2016,131,Relaciones institucionales
2016,132,Procesos electorales
2016,141,Política económica y presupuestaria
2016,151,"Transparencia, comunicación y participación"
2016,211,Actuaciones en materia de justicia
2016,222,Seguridad y orden público
2016,223,Protección civil
2016,231,Relaciones exteriores
2016,232,Cooperación internacional
2016,311,"Administración, inspección y control de seguridad social y protección social"
2016,312,Asistencia al desempleo
2016,313,Acción social
2016,314,Pensiones y otras prestaciones económicas
2016,322,Promoción del empleo
2016,323,Promoción sociocultural
2016,324,Relaciones laborales
2016,411,Administración general de sanidad
2016,412,Servicios asistenciales de salud
2016,413,Acciones públicas relativas a la salud
2016,421,Administración general de educación
2016,422,Enseñanza
2016,423,Promoción educativa
2016,431,Vivienda
2016,441,"Ordenación, control e información sobre el consumo"
2016,451,Administración general de cultura
2016,455,Promoción cultura
2016,461,Deportes
2016,511,Administración general de infraestructuras básicas y transportes
2016,521,Transporte terrestre
2016,522,Transporte marítimo y aereo
2016,531,Ordenación del territorio
2016,541,Investigación y documentación científica
2016,542,Investigación técnica y aplicada
2016,551,Sociedad de la información y el conocimiento y telecomunicaciones
2016,561,Recursos hidraulicos
2016,562,Saneamiento y abastecimiento de aguas
2016,571,Protección y conservación del medio natural
2016,572,Prevención y control ambiental
2016,581,Infraestructuras para el desarrollo rural
2016,591,Cartografía y estadística
2016,711,"Administración general de agricultura, ganadería y pesca"
2016,714,Ordenación de las producciones y regulación de los mercados agrarios
2016,718,Protección de los recursos pesqueros y reforma de las estructuras
2016,721,Administración general de industria
2016,722,Actuaciones administrativas sobre la industria
2016,723,Reconversión y modernización de empresas
2016,731,Planificación y producción energética
2016,741,Fomento de la minería y de las comarcas mineras
2016,751,Ordenación y promoción turística
2016,761,Comercio
2016,811,Fondo de contingencia
2016,912,Apoyo financiero a administraciones públicas territoriales
2016,011A,Amortización y gastos financieros de la deuda pública
2016,111A,Actividad legislativa
2016,111B,Control externo y de las administraciones
2016,111C,Asesoramiento consultivo institucional
2016,111D,"Asesoramiento en materia social, económica y laboral"
2016,111E,Control patrimonial de los cargos públicos
2016,111F,Control de los medios de comunicación audiovisual
2016,112F,Calidad en el Govern de les Illes Balears
2016,121A,Servicios generales de la Presidencia
2016,121B,Dirección y servicios generales de la Conselleria de Presidència
2016,121C,Coordinación de programas de gobierno
2016,121G,Formación y selección del personal
2016,121H,Gestión de recursos humanos
2016,121I,Salud y prevención de riesgos laborales en la Administración
2016,126B,Publicaciones i Boletín Oficial de las Islas Baleares
2016,126E,Servicios de la Abogacía y coordinación de los servicios jurídicos
2016,126F,Servicios comunes generales
2016,126H,"Asesoramiento, estudio, investigación y difusión normativa"
2016,126I,Gestión del parque móvil
2016,126J,Gestión de la central de contratación
2016,126K,Gestión de la Junta Consultiva de Contratación
2016,126L,Servicios comunes tecnológicos
2016,126M,Contratación centralizada
2016,131A,Relaciones con el Parlament
2016,131B,Relaciones y cooperación con otras administraciones públicas y entes públicos y privados
2016,131C,Fomento de la participación de centros y casas regionales en las Illes Balears
2016,132A,"Organización, gestión y seguimiento de procesos electorales"
2016,141A,Dirección y servicios generales de Hacienda y Administraciones Públicas
2016,141B,Planificación presupuestaria y financiación
2016,141C,Gestión contable y control interno
2016,141D,Planificación y ordenación de la politica económica
2016,141E,Gestión de tesorería y política financiera
2016,141F,Organización y control del patrimonio de la Comunidad Autónoma
2016,141G,Gestión de los fondos procedentes de la Unión Europea
2016,151A,Comunicación institucional
2016,151B,Fomento de proyectos de comunicación de interés social
2016,151C,"Calidad, transparencia y participación"
2016,211A,Colaboraciones institucionales en materia de justicia
2016,222A,Seguridad en los edificios administrativos de la CAIB
2016,222B,Actividades clasificadas y espectáculos
2016,222C,Actuación de policías
2016,223A,Emergencias
2016,231A,Coordinación de la acción exterior del Govern
2016,231B,Fomento y relaciones con comunidades baleares radicades en el exterior
2016,232A,Cooperación internacional
2016,313A,Centros asistenciales
2016,313B,Atención a la discapacidad
2016,313C,Medidas judiciales y prevención del delito
2016,313D,Atención a la dependencia
2016,313F,Protección y defensa de los derechos de los menores
2016,313G,Familia y unidades de convivencia
2016,313I,Planificación y ordenación sociales
2016,313J,Integración social de inmigrantes
2016,313K,Dirección y servicios generales de Servicios Sociales y Cooperación
2016,314A,Pensiones y prestaciones económicas
2016,322A,Empleo e inserción laboral específicos
2016,322B,Gestión de las relaciones laborales
2016,322C,Planificación estratégica del empleo
2016,322D,Fomento y gestión del empleo en las Illes Balears
2016,323A,Protección y fomento de la integración y fomento de la participación social de la juventud
2016,323C,"Promoción, protección y servicios para la mujer"
2016,324A,Salud y prevención de riesgos laborales
2016,411A,Dirección y servicios generales de Salud
2016,411D,"Planificación, evaluación y cartera de servicios"
2016,411E,Financiación de la asistencia sanitaria
2016,413A,"Acreditación, docencia e investigación en salud"
2016,413B,Programas de salud pública
2016,413C,Sanidad ambiental y alimentaria
2016,413D,Coordinación de centros insulares
2016,413E,Plan autonómico de drogas
2016,413F,"Planificación, control y gestión del medicamento y de los servicios farmaceuticos"
2016,421A,Dirección y servicios generales de Educación y Universidad
2016,421B,Ordenación general del sistema educativo
2016,421C,Planificación educativa y régimen de centros escolares
2016,421D,Formación del profesorado
2016,421E,Proyectos lingüísticos
2016,421F,Política y actuaciones en materia universitaria
2016,421G,Formación profesional y aprendizaje permanente
2016,421H,Inspección educativa
2016,421I,Administración y servicios de apoyo a la enseñanza
2016,421K,Innovación y comunidad educativa
2016,422A,Educación pública
2016,422B,Educación concertada
2016,423A,Becas y ayudas al estudio
2016,423B,Otros servicios a la enseñanza
2016,431A,Gestión y fomento de la vivienda social
2016,431B,"Arquitectura, vivienda y protección del patrimonio"
2016,441A,Protección y defensa del consumidor
2016,443A,Administración y planes medioambientales
2016,443J,Gestión de espacios naturales
2016,443K,Seguimiento y vigilancia del cambio climático
2016,443L,Espacios de relevancia ambiental (Xarxa Natura 2000)
2016,443M,Educación ambiental y sociedad
2016,443N,Formación y educación en relación al mar
2016,443P,Calidad de las aguas de baño
2016,443Q,Calidad del aire y contaminación atmosférica
2016,451A,"Dirección y servicios generales de Transparencia, Cultura y Deportes"
2016,455A,Promoción y servicios de cultura
2016,455B,Planificación  y normalización de la lengua catalana
2016,461A,Promoción y fomento del deporte
2016,463C,Proyectos de comunicación de interés social
2016,463D,Elecciones y partidos políticos
2016,463E,"Participación, transparencia, buen gobierno y voluntariado"
2016,511B,"Dirección y servicios generales de Territorio, Energía y Movilidad"
2016,513C,Ordenación e inspección del transporte terrestre
2016,513D,Infraestructuras básicas
2016,521A,Infraestructuras básicas
2016,521B,Ordenación e inspección del transporte terrestre
2016,521C,Transporte ferroviario
2016,522A,Puertos y transporte marítimo
2016,522B,Aeropuertos y transporte aereo
2016,531A,Infraestructuras agrarias de las zonas rurales
2016,533A,Conservación y mejora del medio natural
2016,533B,Planificación forestal
2016,533D,"Gestión de espacios naturales protegidos, parques naturales, áreas recreativas y fincas públicas"
2016,533F,Especies silvestres: conservación i sensibilización
2016,533G,Gestión de la sanidad forestal
2016,541A,Investigación y desarrollo tecnológico
2016,542A,Innovación tecnológica
2016,551A,"Ordenación, regulación y desarrollo de las telecomunicaciones"
2016,551B,Gestión de los sistemas y las tecnologías de la información
2016,561A,Dominio público hidráulico: protección y control. Directiva marco del agua
2016,562A,Abastecimiento de agua
2016,562B,Saneamiento y depuración de aguas
2016,571A,Gestión de residuos
2016,571B,Educación ambiental
2016,571C,Gestión de espacios naturales
2016,571D,Conservación y mejora del medio natural
2016,571E,Planificación forestal
2016,571F,Especies silvestres
2016,571G,Sanidad forestal
2016,572A,"Seguimiento y contol del cambio climático, calidad del aire y contaminación atmosférica"
2016,581A,Infraestructuras de regadío
2016,591A,Estadística
2016,591B,Cartografía
2016,611A,Dirección y servicios generales de Hacienda y Administraciones Públicas
2016,612A,Planificación y ordenación de la política económica
2016,612B,Planificación y política presupuestaria
2016,612C,Gestión contable y control interno
2016,612E,Gestión de tesoreria y política financiera
2016,612G,Organización y gestión del Patrimonio de la Comunidad Autónoma
2016,612H,Gestión de los fondos procedentes de la Unión Europea
2016,633A,Imprevistos y funciones no clasificadas
2016,634A,Fondo de contingencia de ejecución presupuestaria
2016,711A,"Dirección y servicios generales de Medio Ambiente, Agricultura y Pesca"
2016,714B,Fomento del sector agrario
2016,718A,Recursos marinos y ordenación del sector pesquero
2016,721A,"Dirección y servicios generales de Trabajo, Comercio e Industria"
2016,722A,Regulación y normativa industrial
2016,723A,Promoción industrial
2016,731A,Fomento de la utilización de energias renovables y del ahorro energético
2016,751A,"Dirección y servicios generales de Innovación, Investigación y Turismo"
2016,751B,Promoción turística
2016,751C,Ordenación del sector y redefinición del modelo turístico
2016,761A,Ordenación y promoción comercial y empresarial
2016,761B,Gestión en materia de juego
2016,763A,Ordenación de las estructuras comerciales y empresariales
2016,811A,Fondo de contingencia
2016,912A,Apoyo financiero a los consejos insulares
2016,912B,Apoyo financiero a ayuntamientos y otros entes locales
2016,011A01,Amortización y gastos financieros de Deuda Pública
2016,011A99,Pagos cuenta 409 OPAP ejercicios anteriores
2016,111A01,Actividad legislativa
2016,111B01,Control externo de las administraciones
2016,111C01,Asesoramiento consultivo institucional
2016,111C99,Pagos cuenta 409 OPAP ejercicios anteriores
2016,111D01,"Asesoramiento en materia social, económica y laboral"
2016,111E01,Control patrimonial de los cargos públicos
2016,111F01,Control de los medios de comunicación audiovisuales
2016,112B01,Relaciones con el Parlamento
2016,112C01,Relaciones y cooperación con otras administraciones públicas y entes públicos y privados
2016,112E01,Coordinación de los programas del Gobierno de las IB
2016,112F01,Calidad en el Gobierno de las IB
2016,121A01,Servicios generales del la Presidencia del Gobierno
2016,121A99,Pagos cuenta 409 OPAP ejercicios anteriores
2016,121B01,Dirección y servicios generales de Presidencia
2016,121B99,Pagos cuenta 409 OPAP ejercicios anteriores
2016,121E01,"Registro, supervisión y relaciones con asociaciones y entidades jurídicas"
2016,121G01,Escuela de las administraciones públicas
2016,121G99,Pagos cuenta 409 OPAP ejercicios anteriores
2016,121H01,Gestión de los recursos humanos
2016,121H99,Pagos cuenta 409 OPAP ejercicios anteriores
2016,121J01,Gestión en materia de juegos
2016,121J99,Pagos cuenta 409 OPAP ejercicios anteriores
2016,121K01,Altres actuacions d'administració general i funció pública
2016,124A01,Cooperació i relacions amb els ens territorials i relacions interadministratives
2016,126A01,Mantenimiento y conservación del Palacio de Marivent
2016,126A99,Pagos cuenta 409 OPAP ejercicios anteriores
2016,126B01,Publicaciones y Boletín Oficial de las IB
2016,126C01,Comunicación y información institucional
2016,126C99,Pagos cuenta 409 OPAP ejercicios anteriores
2016,126E01,Servicios de la Abogacía y coordinación de los servicios jurídicos de la CAIB
2016,126F01,Servicios comunes generales
2016,126H01,"Asesoramiento, estudio, investigación y difusión normativa"
2016,126I01,Gestión del parque móvil
2016,126I99,Pagos cuenta 409 OPAP ejercicios anteriores
2016,126J01,Gestión de la central de contratación
2016,126K01,Gestión de la Junta Consultiva de Contratación
2016,126L01,Servicios comunes tecnológicos
2016,126L99,Pagos cuenta 409 OPAP ejercicios anteriores
2016,126M01,Contratación centralizada
2016,131A01,Coordinación de la acción exterior del Gobierno
2016,131B01,Fomento y relaciones con comunidades baleares radicadas en el exterior
2016,134A01,Planificación y evaluación de la cooperación al desarrollo
2016,141A01,Colaboraciones institucionales en materia de justicia
2016,222A01,Seguridad en los edificios administrativos de la CAIB
2016,222B01,Actividades clasificadas y espectáculos
2016,222C01,Actuación de policías
2016,222C99,Pagos cuenta 409 OPAP ejercicios anteriores
2016,223A01,Planificación de emergencias
2016,223A99,Pagos cuenta 409 OPAP ejercicios anteriores
2016,313A01,Centros asistenciales
2016,313C01,Medidas judiciales y prevención del delito
2016,313C99,Pagos cuenta 409 OPAP ejercicios anteriores
2016,313D01,Protección y acción social
2016,313D99,Pagos cuenta 409 OPAP ejercicios anteriores
2016,313F01,Protección y defensa de los derechos de los menores
2016,313G01,Familia y unidades de convivencia
2016,313G99,Pagos cuenta 409 OPAP ejercicios anteriores
2016,313I01,Planificación y ordenación social
2016,313I99,Pagos cuenta 409 OPAP ejercicios anteriores
2016,313J01,Integración social de inmigrantes
2016,313J99,Pagos cuenta 409 OPAP ejercicios anteriores
2016,313K01,Dirección y servisios generales de Servicios Sociales y Cooperación
2016,313K99,Pagos cuenta 409 OPAP ejercicios anteriores
2016,314A01,Pensiones y prestaciones económicas
2016,315B01,Salud y prevención de riesgos laborales
2016,315B99,Pagos cuenta 409 OPAP ejercicios anteriores
2016,315C01,Fomento de la responsabilidad social corporativa
2016,315D01,Salud y prevención de riesgos laborales en la administración
2016,315D99,Pagos cuenta 409 OPAP ejercicios anteriores
2016,322A01,Empleo e inserción laboral específicos
2016,322B01,Gestión de la relaciones laborales
2016,322D01,Dirección y servicios generales del Servicio de Empleo de las IB
2016,322D02,Orientación y información laboral
2016,322D03,Formación para desempleados
2016,322D04,Gestión de acciones formativas
2016,322D05,Fomento del empleo
2016,322D06,Formación profesional dirigida a desempleados
2016,322D07,Formación profesaional dirigida a empleados
2016,322D08,Oportunidades de empleo y de formación
2016,322D99,Pagos cuenta 409 OPAP ejercicios anteriores
2016,323A01,Protección y fomento de la integración y fomento de la participación social de la juventud
2016,323A02,Consejo de la Juventud de las IB
2016,323C01,"Promoción, protección y servicios para la mujer"
2016,323C99,Pagos cuenta 409 OPAP ejercicios anteriores
2016,323D01,Fomento de la participación de centros y casa regionales en las IB
2016,411A01,Dirección y servicios generales de Salud
2016,411A99,Pagos cuenta 409 OPAP ejercicios anteriores
2016,411D01,Planificación de la asistencia sanitaria
2016,411D99,Pagos cuenta 409 OPAP ejercicios anteriores
2016,411E01,Financiación de la sanidad
2016,413A01,Ordenación y inspección de los servicios sanitarios
2016,413A99,Pagos cuenta 409 OPAP ejercicios anteriores
2016,413B01,Programas de salud pública
2016,413B99,Pagos cuenta 409 OPAP ejercicios anteriores
2016,413C01,Sanidad ambiental y alimentaria
2016,413C99,Pagos cuenta 409 OPAP ejercicios anteriores
2016,413D01,Coordinación de centros insulares
2016,413D99,Pagos cuenta 409 OPAP ejercicios anteriores
2016,413E01,Plan autonómico de drogas
2016,413F01,"Planificación, control y gestión del medicamento y de los servicios farmacéuticos"
2016,413F99,Pagos cuenta 409 OPAP ejercicios anteriores
2016,421A01,Dirección y servicios generales de Educación y Universidad
2016,421A02,Consejo escolar de las IB
2016,421A03,Instituto de calidad y evaluación del sistema educativo
2016,421A99,Pagos cuenta 409 OPAP ejercicios anteriores
2016,421B01,Ordenación general del sistema educativo
2016,421B02,Programas internacionales
2016,421B99,Pagos cuenta 409 OPAP ejercicios anteriores
2016,421C01,Planificación educativa y régimen de funcionamiento de centros escolares
2016,421C99,Pagos cuenta 409 OPAP ejercicios anteriores
2016,421D02,Formación del profesorado
2016,421D03,Aprendizaje permanente
2016,421F01,Política y actuaciones en materia universitaria
2016,421G01,Ordenación de la formación profesional
2016,421G02,Instituto de cualificaciones
2016,421G99,Pagos cuenta 409 OPAP ejercicios anteriores
2016,421H01,Inspección educativa
2016,421H99,Pagos cuenta 409 OPAP ejercicios anteriores
2016,421I01,Gestión y nóminas del personal docente
2016,421I02,"Administración y servicios a centros concertados, infantil y primaria"
2016,421I03,"Administración y servicios a centros concertados, ESO, bachillerato y FP"
2016,421I04,"Administración y servicios a centros concertados, regímenes especiales"
2016,421I05,"Administración y servicios a centros concertados, educación especial"
2016,421I06,"Administración y servicios a centros concertados, educación de adultos"
2016,421I99,Pagos cuenta 409 OPAP ejercicios anteriores
2016,421K01,Soporte educativo
2016,421K02,Innovación educativa
2016,421K03,Comunidad educativa
2016,421K04,Instituto de Educación a la Primera Infancia
2016,421K05,Instituto para la Convivencia y el Éxito Escolar
2016,421K06,Archivo y Museo de la Educación de las IB
2016,421K99,Pagos cuenta 409 OPAP ejercicios anteriores
2016,422A01,Educación pública
2016,422A99,Pagos cuenta 409 OPAP ejercicios anteriores
2016,422B01,Educació infantil
2016,422B02,Educación primaria
2016,422B03,Educación secundaria obligatoria y bachillerato
2016,422B04,Formación profesional
2016,422G01,Tecnologías de la información y de la comunicación en el ámbito escolar
2016,422G99,Pagos cuenta 409 OPAP ejercicios anteriores
2016,423B01,Infraestructuras en centros docentes
2016,423B02,Equipamiento y mobiliario escolar
2016,423B03,Gastos de funcionamiento de centros
2016,423B99,Pagos cuenta 409 OPAP ejercicios anteriores
2016,431B01,Vivienda
2016,431B02,Protección del patrimonio
2016,441A01,Abastecimiento de aguas
2016,441B01,Saneamiento y depuración de aguas
2016,443B01,"Calidad ambiental, control de la contaminación y asesoría medioambiental"
2016,443C01,Gestión de residuos
2016,443E01,Protección y defensa del consumidor
2016,443E99,Pagos cuenta 409 OPAP ejercicios anteriores
2016,443K01,Seguimiento y vigilancia del cambio climático
2016,443L01,"Espacios de relevancia ambiental, Red Natura 2000"
2016,443M01,Educación ambiental y sociedad
2016,443M99,Pagos cuenta 409 OPAP ejercicios anteriores
2016,443Q01,Calidad del aire y contaminación atmosférica
2016,443Q99,Pagos cuenta 409 OPAP ejercicios anteriores
2016,451A01,"Dirección y servicios generales de Participación, Transparencia y Cultura"
2016,451A99,Pagos cuenta 409 OPAP ejercicios anteriores
2016,455A01,Promoción de la cultura y de la lengua de las IB
2016,455A04,Museos
2016,455A05,Archivos
2016,455A06,Bibliotecas
2016,455A99,Pagos cuenta 409 OPAP ejercicios anteriores
2016,455B01,Planificación y normalización de la lengua catalana
2016,455B99,Pagos cuenta 409 OPAP ejercicios anteriores
2016,457A01,Promoción y fomento del deporte
2016,457A99,Pagos cuenta 409 OPAP ejercicios anteriores
2016,463B01,Información y atención a la ciudadanía
2016,463C01,Fomento de proyectos de comunicación y de interés social
2016,463C99,Pagos cuenta 409 OPAP ejercicios anteriores
2016,463E01,Fomento de la participación ciudadana
2016,463E99,Pagos cuenta 409 OPAP ejercicios anteriores
2016,511B01,"Dirección y servicios generales de Territorio, Energía y Movilidad"
2016,511B99,Pagos cuenta 409 OPAP ejercicios anteriores
2016,511C01,Fomento de la participación ciudadana
2016,511E01,Gestión de los transportes aéreo y marítimo en las IB
2016,512A01,"Protección y control del dominio público hidráulico, directiva marco del agua"
2016,512A99,Pagos cuenta 409 OPAP ejercicios anteriores
2016,513C01,Ordenación e inspección del transporte terrestre
2016,513D01,Redes viarias
2016,513D99,Pagos cuenta 409 OPAP ejercicios anteriores
2016,514A01,Ordenación del litoral
2016,514B01,Gestión de las instalaciones portuarias
2016,521A01,"Ordenación, regulación y desarrollo de las telecomunicaciones"
2016,521B01,Gestión de los sistemas y tecnologías de la información
2016,531A01,Infraestructura agrarias de las zonas rurales
2016,533A01,Conservación y mejora del medio natural
2016,533B01,Planificación forestal
2016,533B99,Pagos cuenta 409 OPAP ejercicios anteriores
2016,533D01,"Gestión de espacios naturales, parques naturales, áreas recreativas y fincas públicas"
2016,533D02,Gestión de la Red Natura 2000 y proyectos
2016,533F01,"Especies silvestres, conservación y sensibilización"
2016,533F99,Pagos cuenta 409 OPAP ejercicios anteriores
2016,533G01,Gestión de la sanidad forestal
2016,541A01,Investigación y desarrollo tecnológico
2016,542A01,Innovación tecnológica
2016,551A01,Estadística
2016,551A99,Pagos cuenta 409 OPAP ejercicios anteriores
2016,611A01,Dirección y servicios generales de Hacienda y Administraciones Públicas
2016,611A99,Pagos cuenta 409 OPAP ejercicios anteriores
2016,612A01,Planificación y ordenación de la política económica
2016,612B01,Planificación y política presupuestaria
2016,612C01,Gestión contable y control interno
2016,612E01,Gestión de tesorería y política financiera
2016,612E99,Pagos cuenta 409 OPAP ejercicios anteriores
2016,612G01,Organización y gestión del patrimonio de la CAIB
2016,612G99,Pagos cuenta 409 OPAP ejercicios anteriores
2016,612H01,Gestión de los fondos procedentes de la UE
2016,612H99,Pagos cuenta 409 OPAP ejercicios anteriores
2016,634A01,Fondo de contingencia de ejecución presupuestaria
2016,711A01,"Dirección y servicios generales de Medio Ambiente, Agricultura y Pesca"
2016,711A99,Pagos cuenta 409 OPAP ejercicios anteriores
2016,714B01,Agricultura
2016,714B02,Ganadería
2016,714B03,Calidad agroalimentaria
2016,714B04,Investigación y formación del sector agrario
2016,714B99,Pagos cuenta 409 OPAP ejercicios anteriores
2016,718A01,Recursos marinos
2016,718A02,Ordenación del sector de la pesca
2016,718A99,Pagos cuenta 409 OPAP ejercicios anteriores
2016,721A01,"Dirección y servicios generales de Trabajo, Comercio e Industria"
2016,721A99,Pagos cuenta 409 OPAP ejercicios anteriores
2016,722A01,Regulación y normativa industrial
2016,722A99,Pagos cuenta 409 OPAP ejercicios anteriores
2016,723A01,Promoción industrial y tecnológica
2016,731C01,Fomento del a utilización de energías renovables y del ahorro de energía
2016,751A01,"Dirección y servicios generales de Innovación, Investigación y Turismo"
2016,751A99,Pagos cuenta 409 OPAP ejercicios anteriores
2016,751C01,Ordenación del sector y redefinición del modelo turístico
2016,763A01,"Ordenación, reforma y modernización de las estructura comerciales"
2016,763A02,Ordenación empresarial
