2017,G,22704,"Custòdia, dipòsit i emmagatzematge"
2017,G,22706,Estudis i treballs tècnics
2017,G,22707,Bugaderia
2017,G,22708,Serveis de recaptació
2017,G,22709,Altres treballs
2017,G,22711,"Serveis assistencials d'altres empreses, laboratoris"
2017,G,22712,Restauració
2017,G,22713,"Serveis no assistencials d'altres empreses, jardineria"
2017,G,22714,"Serveis no assistencials d'altres empreses, manteniment ascensors"
2017,G,22715,"Serveis no assistencials d'altres empreses, altres"
2017,G,22716,"Serveis de professionals independents, llicenciats sanitaris"
2017,G,22718,Serveis de professionals independents
2017,G,22719,"Serveis de professionals independents, altres"
2017,G,22720,Gestió de residus
2017,G,22721,Prevenció de riscs laborals
2017,G,22722,Consultoria de sistemes d'informació
2017,G,22723,Consultoria de qualitat i medi ambient
2017,G,22724,"Manteniment aparells sanitaris,'Hospital de Son Espases"
2017,G,23000,"Dietes, locomoció i trasllats"
2017,G,23001,Locomoció
2017,G,25102,"Serveis assistencials concertats/prestats per tercers, PADI programa d'atenció dental infantil"
2017,G,25200,"Serveis assistencials concertats/prestats per tercers, atenció especialitzada"
2017,G,25300,"Serveis assistencials concertats/prestats per tercers, programes especials d'hemodiàlisi"
2017,G,25301,"Serveis assistencials concertats/prestats per tercers, club diàlisi"
2017,G,25405,"Serveis assistencials concertats/prestats per tercers, Medisub càmera hiperbàrica"
2017,G,25406,"Serveis assistencials concertats/prestats per tercers, teràpies respiratòries"
2017,G,25408,"Serveis assistencials concertats/prestats per tercers, RMN ressonància magnètica nuclear"
2017,G,25409,"Serveis assistencials concertats/prestats per tercers, altres tècniques de diagnosi per imatge"
2017,G,25411,"Serveis assistencials concertats/prestats per tercers, Fundació Kovacs"
2017,G,25413,"Serveis assistencials concertats/prestats per tercers, oxigenoterapia"
2017,G,25414,"Serveis assistencials concertats/prestats per tercers, aerosolteràpia"
2017,G,25500,"Serveis assistencials concertats/prestats per tercers, transport sanitari terrestre"
2017,G,25501,"Serveis assistencials concertats/prestats per tercers, transport sanitari aeri"
2017,G,25800,Serveis assistencials concertats/prestats per tercers
2017,G,25900,"Serveis assistencials concertats/prestats per tercers, altres"
2017,G,31000,Interessos
2017,G,35200,Interessos de demora
2017,G,35900,Altres despeses financeres
2017,G,35990,"Interessos d'arrendaments financers amb opció de compra, leasing"
2017,G,48604,"Entregues per a desplaçaments, particulars"
2017,G,48605,Entregues per a desplaçaments
2017,G,48606,Entregues per a pròtesis
2017,G,48607,Entregues per a vehicles per a minusvàlids
2017,G,48900,Receptes mèdiques
2017,G,48910,Reintegrament de despeses de farmàcia
2017,G,48911,"Reintegrament de despeses de farmàcia, dispensació ambulatòria"
2017,G,62200,Edificis i altres construccions
2017,G,62201,Construccions noves en curs
2017,G,62302,Maquinària
2017,G,62303,Utillatge
2017,G,62304,Equips i aparells medicoassistencials
2017,G,62306,Instal·lacions tècniques
2017,G,62400,Elements de transport
2017,G,62501,Equips d'oficina i electrodomèstics
2017,G,62502,Mobiliari
2017,G,62600,Equips per a processos d'informació
2017,G,63201,Construccions en curs
2017,G,63302,Maquinària
2017,G,63303,Utillatge
2017,G,63304,Equips i aparells medicoassistencials
2017,G,63306,Instal·lacions tècniques
2017,G,63400,Elements de transport
2017,G,63501,Equips d'oficina i electrodomèstics
2017,G,63502,Mobiliari
2017,G,63600,Equips per a processos d'informació
2017,G,64006,Aplicacions informàtiques
2017,G,64090,"Arrendament financer amb opció de compra, leasing"
2017,G,91000,Amortització de préstecs a curt termini d'ens del sector públic
2017,G,91100,Amortització de préstecs a llarg termini d'ens del sector públic
2017,G,12199,Altres complements
2017,G,22402,XXX
2017,G,44700,Subv.ent.públiques empresarials i altres ens públ.
2017,G,44713,Subv. a la Universitat de les Illes Balears
2017,G,44865,Subv. a Consorci Sistema Observació Costanera IB
2017,G,44921,Subv. Fundació Banc de Sang i Teixits
2017,G,44923,Subv. Fund.Investigació Sanitària Ramon Llull
2017,G,74700,Subv.ent.públiques empresarials i altres ens públ.
2017,G,74713,Subv. a la Universitat de les Illes Balears
2017,G,74865,Subv. a Consorci Sistema Observació Costanera IB
2017,G,74921,Subv. Fundació Banc de Sang i Teixits
2017,G,74923,Subv. Fund.Investigació Sanitària Ramon Llull
2017,G,44400,A fundacions del sector públic autonòmic
2017,G,74352,Al Consorci Museu Militar de Menorca
2017,G,45100,A altres comunitats autònomes
2017,G,46114,"A consells insulars, programa de valors esportius"
2017,G,90100,Amortització de deute públic en euros a llarg term
2017,G,44904,Subv. Fund.Institut Socioeducatiu s'Estel
2017,G,44711,Subv. a l'Institut Balear de la Natura
2017,G,44826,Subv. a Escola d'Hoteleria
2017,I,30911,Per autorització sondeigs a càrrec de la Junta d'Aigües
2017,I,30912,Per autorització instal·lacions d'elevació d'aigües
2017,I,30913,Per serveis administratius per explotació aigües subterrànies <7000m3/any
2017,I,30914,Per serveis administratius concessió d'aigües subterrànies
2017,I,30921,Per informes i altres actuacions sobre concessions
2017,I,30927,Per serveis del laboratori de l'aigua
2017,I,30928,Per reportatges publicitaris en espais naturals
2017,I,30970,Per serveis facultatius veterinaris
2017,I,79200,Transferències de capital del FEOGA-Orientació
2017,I,30976,Per tramitació sol·licitud concessió etiqueta ecològica
2017,I,30977,Per la utilització de l'etiqueta ecològica
2017,I,28100,Impost sobre estades turístiques i turisme sostenible
