2012,G,78,Transferències de capital a famílies i institucions sense ànim de lucre
2012,G,79,Transferències de capital a l'exterior
2012,G,83,Concessió de préstecs fora del sector públic
2012,G,84,Constitució de dipòsits i fiances
2012,G,87,Aportacions patrimonials
2012,G,91,Amortització de préstecs en euros
2012,G,93,Amortització de préstecs en divises
2012,G,94,Devolució de dipòsits i fiances
2012,G,100,Retribucions bàsiques i altres remuneracions alts càrrecs
2012,G,107,Aportacions a plans de pensions alts càrrecs
2012,G,110,Retribucions bàsiques i altres remuneracions personal eventual
2012,G,117,Aportacions a plans de pensions personal eventual
2012,G,120,Retribucions bàsiques personal funcionari i estatutari
2012,G,121,Retribucions complementàries personal funcionari i estatutari
2012,G,122,Retribucions en espècie personal funcionari i estatutari
2012,G,124,Retribucions de funcionaris en pràctiques
2012,G,125,Retribucions d'altre personal estatutari temporal
2012,G,127,Aportacions a plans de pensions
2012,G,130,Retribucions personal laboral fix
2012,G,131,Retribucions personal laboral temporal
2012,G,132,Retribucions en espècie personal laboral
2012,G,133,Retribucions personal contractat d'investigació
2012,G,137,Aportacions a plans de pensions personal laboral
2012,G,138,Indemnitzacions
2012,G,141,Retribucions d'altre personal
2012,G,147,Aportacions a plans de pensions altre personal
2012,G,149,Retribucions personal pendent d'integració a RLT
2012,G,150,Incentius al rendiment: Productivitat
2012,G,151,Incentius al rendiment: Gratificacions
2012,G,160,Quotes socials
2012,G,161,Prestacions socials
2012,G,162,Despeses socials a favor funcionari i personal no laboral
2012,G,163,Despeses socials a favor del personal laboral
2012,G,200,Arrendaments de terrenys i béns naturals
2012,G,202,Arrendaments d'edificis i d'altres construccions
2012,G,203,"Arrendaments de maquinària, instal·lacions i utill"
2012,G,204,Arrendaments de material de transport
2012,G,205,Arrendaments de mobiliari i estris
2012,G,206,Arrendaments d'equips per a processos d'informació
2012,G,208,Arrendaments d'altre immobilitzat material
2012,G,209,Cànons
2012,G,210,Reparacions i manteniment d'infraestructura i béns naturals
2012,G,212,Reparacions i manteniment d'edificis i d'altres construccions
2012,G,213,"Reparacions i manteniment de maquinària, instal·lacions i utillatge"
2012,G,214,Reparacions i manteniment de material de transport
2012,G,215,Reparacions i manteniment de mobiliari i estris
2012,G,216,Reparacions i manteniment d'equips per a processos d'informació
2012,G,219,Reparacions i manteniment d'altre immobilitzat material
2012,G,220,Material d'oficina
2012,G,221,Subministraments
2012,G,222,Comunicacions
2012,G,223,Transports
2012,G,224,Primes d'assegurances
2012,G,225,Tributs
2012,G,226,Despeses diverses
2012,G,227,Treballs realitzats per altres empreses i professi
2012,G,229,Obligacions d'exercicis anteriors
2012,G,230,"Dietes, locomoció i trasllats"
2012,G,231,Assistències i pernoctes
2012,G,239,Altres indemnitzacions
2012,G,251,Concerts amb institucions d'atenció primària
2012,G,252,Concerts amb institucions d'atenció especialitzada
2012,G,253,Concerts per a programes especials d'hemodiàlisi
2012,G,254,"Concerts amb serv.diagnòstic,tractament i teràpies"
2012,G,255,Concerts per al Programa Especial de Transport
2012,G,258,Assistència sanitària prestada per tercers
2012,G,259,Altres serveis d'assistència sanitària
2012,G,310,Interessos de préstecs en euros
2012,G,311,"Despeses formalització, modificació i cancel·lació de préstecs en euros"
2012,G,319,Altres despeses financeres de préstecs en euros
2012,G,330,Interessos de préstecs en divises
2012,G,331,"Despeses formalització, modificació i cancel·lació de préstecs en divises"
2012,G,332,Diferències de canvi
2012,G,339,Altres despeses financeres
2012,G,340,Interessos de dipòsits
2012,G,341,Interessos de fiances
2012,G,352,Interessos de demora
2012,G,359,Altres despeses financeres
2012,G,400,Transferències corrents a l'Administració General de l'Estat
2012,G,401,Transferències corrents a organismes autònoms estatals
2012,G,402,Transferències corrents a la Seguretat Social
2012,G,404,"Transferències corrents a soc.merc.estatals, ent.empres. i altres ens púb."
2012,G,440,Transferències corrents a societats mercantils públiques autonòmiques
2012,G,441,Transferències corrents a entitats públiques empresarials i altres ens públics autonòmics
2012,G,442,Transferències corrents a empreses vinculades a la Comunitat Autònoma
2012,G,443,Transferències corrents a consorcis en què participa la Comunitat Autònoma
2012,G,444,Transferències corrents a fundacions del sector públic autonòmic
2012,G,445,Transferències corrents a altres fundacions en què participa la com.aut.
2012,G,450,Transferències corrents a la comunitat autònoma de les Illes Balears
2012,G,451,Transferències corrents a altres comunitats autònomes
2012,G,460,Transferències corrents a ajuntaments
2012,G,461,Transferències corrents a consells insulars
2012,G,464,Transferències corrents a empreses públiques i altres ens públics de corporacions locals
2012,G,469,transferències corrents a altres ens territorials
2012,G,480,Transferències corrents a famílies i institucions sense ànim de lucre
2012,G,486,"Altres prestacions,indemnitzacions i entregues reg"
2012,G,489,Farmàcia
2012,G,600,Inversió nova: terrenys i béns naturals
2012,G,601,Inversió nova: infraestructura i béns destinats a l'ús general
2012,G,609,Altres inversions noves
2012,G,610,Inversió de reposició: terrenys i béns naturals
2012,G,611,Inversió de reposició: Infraestructura i béns destinats a l'ús general
2012,G,619,Altres inversions de reposició
2012,G,620,Inversió nova associada al funcionament dels serveis: terrenys i béns naturals
2012,G,622,Inversió nova associada al fiuncionament dels serveis: edificis i altres construccions
2012,G,623,"Inversió nova associada al funcionament dels serveis: maquinària, instal·lacions i utillatge"
2012,G,624,Inversió nova associada al funcionament dels serveis: elements de transport
2012,G,625,Inversió nova associada al funcionament dels serveis: mobiliari i estris
2012,G,626,Inversió nova associada al funcionament dels serveis: equips per a processos d'informació
2012,G,629,Inversió nova associada al funcionament dels serveis: altre immobilitzat material
2012,G,630,Inv reposició associada al funcionament dels serveis: terrenys i béns naturals
2012,G,632,Inv reposició associada al funcionament dels serveis: edificis i altres construccions
2012,G,633,"Inv reposició associada al funcionament dels serveis: maquinària, instal·lacions i utillatge"
2012,G,634,Inv reposició associada al funcionament dels serveis: elements de transport
2012,G,635,Inv reposició associada al funcionament dels serveis: mobiliari i estris
2012,G,636,Inv reposició associada al funcionament dels serveis: equips per a processos d'informació
2012,G,639,Inv reposició associada al funcionament dels serveis: Altre immobilitzat material
2012,G,640,Despeses en inversions de caràcter immaterial
2012,G,700,Transferències de capital a l'Administració General de l'Estat
2012,G,701,Transferències de capital a organismes autònoms estatals
2012,G,702,Transferències de capital a la Seguretat Social
2012,G,704,"Transferències de capital a soc.merc.estatals, ent.empres. i altres ens públ"
2012,G,720,Transferències de capital a l'entitat gestora del sistema sanitari
2012,G,740,Transferències de capital a societats mercantils públiques
2012,G,741,Transferències de capital a entitats públiques empresarials i altres ens púb
2012,G,742,Transferències de capital a empreses vinculades a la Comunitat Autònoma
2012,G,743,Transferències de capital a consorcis en què participa la Comunitat Autònoma
2012,G,744,Transferències de capital a fundacions del sector públic autonòmic
2012,G,745,Transferències de capital a altres fundacions en què participi la com.aut.
2012,G,750,Transferències a la Comunitat Autònoma de les Illes Balears
2012,G,751,Transferències a altres comunitats autònomes
2012,G,760,Transferències de capital a ajuntaments
2012,G,761,Transferències de capital a consells insulars
2012,G,764,Transferències de capital a empreses públiques i altres ens de corp.locals
2012,G,769,Transferències de capital a altres ens territorials
2012,G,770,Transferències de capital a empreses privades
2012,G,780,Transferències de capital a famílies i institucions sense ànim de lucre
2012,G,790,Transferències de capital a l'exterior
2012,G,830,Concessions de préstecs fora del sector públic a curt termini
2012,G,831,Concessions de préstecs fora del sector públic a llarg termini
2012,G,840,Constitució de dipòsits
2012,G,841,Constitució de fiances
2012,G,871,Aportacions patrimonials a societats mercantils públiques
2012,G,910,Amortització de préstecs a curt termini d'ens del sector públic
2012,G,911,Amortització de préstecs llarg termini d'ens del sector públic
2012,G,912,Amortització préstecs curt termini ens fora sector públic
2012,G,913,Amortització préstecs llarg termini ens fora sector públic
2012,G,930,Amortització de préstecs en divises a curt termini
2012,G,931,Amortització de préstecs en divises a llarg termin
2012,G,940,Devolució de dipòsits
2012,G,941,Devolució de fiances
2012,G,10000,Retribucions bàsiques d'alts càrrecs
2012,G,10001,Altres remuneracions d'alts càrrecs
2012,G,10002,Triennis d'alts càrrecs
2012,G,11000,Retribucions bàsiques del personal eventual
2012,G,11001,Altres remuneracions del personal eventual
2012,G,11002,Triennis del personal eventual
2012,G,12000,Sous del subgrup A1
2012,G,12001,Sous del subgrup A2
2012,G,12002,Sous del subgrup C1
2012,G,12003,Sous del subgrup C2
2012,G,12004,Sous d'agrupacions professionals
2012,G,12005,Triennis
2012,G,12006,Sous del subgrup A1 personal de contingent
2012,G,12007,Sous del subgrup A2 personal de contingent
2012,G,12009,Altres retribucions bàsiques
2012,G,12100,Complement de destinació
2012,G,12101,Complement específic
2012,G,12102,Complement de productivitat compensada
2012,G,12103,Indemnització per residència
2012,G,12105,Complement específic personal facultatiu
2012,G,12106,Compl. específic personal sanitari no facultatiu
2012,G,12108,"Complement esp.turniciat, personal no sanitari"
2012,G,12109,Complement atenció continuada personal facultatiu
2012,G,12111,Complement específic variable
2012,G,12112,"Productivitat sanitària, fixa i compensada"
2012,G,12113,Compl. atenció continuada personal no sanitari
2012,G,12114,Compl. atenció continuada personal cont.preinteg
2012,G,12115,Coplements transitoris absorbibles
2012,G,12116,Retribucions complementàries personal contingent
2012,G,12117,Altres complements
2012,G,12118,"Complement esp.turniciat, pers sanitari  no facult"
2012,G,12119,Carrera i desenvolup. prof. pers. func. i estatut.
2012,G,12122,Compl. atenció continuada pers. sanit. no facult.
2012,G,12200,Casa habitatge
2012,G,12201,Vestuari
2012,G,12202,Bonificacions
2012,G,12209,Altres
2012,G,12400,Sous del subgrup A1
2012,G,12401,Sous del subgrup A2
2012,G,12402,Sous del subgrup C1
2012,G,12403,Sous del subgrup C2
2012,G,12404,Sous d'agrupacions professionals
2012,G,12405,Triennis
2012,G,12406,Retribucions complementàries
2012,G,12500,Sous subgrup A1 personal estaturi temporal
2012,G,12501,Sous subgrup A2 personal estaturi temporal
2012,G,12502,Sous subgrup C1 personal estaturi temporal
2012,G,12503,Sous subgrup C2 personal estaturi temporal
2012,G,12504,Sous agr.professionals; personal estaturi temporal
2012,G,12505,Retribucions complementàries pers.estatut.temporal
2012,G,12506,Complement de destinació personal estat. temporal
2012,G,12507,Complement específic personal no sanitari temporal
2012,G,12508,Indemnització per residència personal estat.temp.
2012,G,12509,Comp.específic personal sanitari no facult.temp.
2012,G,12510,Complement específic personal facultatiu temporal
2012,G,12511,Comp.atenció continua personal facultatiu temporal
2012,G,12512,Comp.aten.cont. pers. sanitari no facultatiu temp.
2012,G,12513,Comp.aten.cont. pers. no sanitari  temporal
2012,G,12515,Triennis d'altre personal estatutari temporal
2012,G,12519,Carrera i desenvolup. prof. pers. estatutari temp.
2012,G,13000,Retribucions bàsiques
2012,G,13001,Complement de conveni
2012,G,13002,Complement de compensació de costos d'insularitat
2012,G,13004,Complement específic
2012,G,13005,Triennis
2012,G,13006,Complement de torns rotatius
2012,G,13009,Altres complements
2012,G,13019,Carrera i desenvolup. prof. pers. laboral
2012,G,13100,Retribucions del personal laboral temporal
2012,G,13200,Casa habitatge
2012,G,13201,Vestuari
2012,G,13202,Bonificacions
2012,G,13209,Altres
2012,G,13300,Personal contractat d'investigació
2012,G,13700,Aportacions a plans de pensions
2012,G,13800,Indemnitzacions
2012,G,14100,Retribucions d'altre personal
2012,G,14119,Carrera i desenvolup. prof. d'altre personal
2012,G,14900,Retribucions personal pendent d'integració a RLT
2012,G,15000,Productivitat
2012,G,15001,"Productivitat personal estatutari, factor fix"
2012,G,15002,Productivitat personal estatutari factor fix APD
2012,G,15003,"Productivitat personal estatutari, factor variable"
2012,G,15004,Prod. personal estatutari temporal factor fix
2012,G,15005,Prod. personal estatutari temporal factor variable
2012,G,15100,Gratificacions
2012,G,16000,Seguretat social
2012,G,16009,Altres quotes socials
2012,G,16100,Pensions a funcionaris a càrrec de la CAIB
2012,G,16101,Pensions a famílies a càrrec de la CAIB
2012,G,16109,Altres prestacions socials
2012,G,16200,Formació i perfeccionament del personal
2012,G,16201,Economats i menjadors
2012,G,16202,Transport de personal
2012,G,16204,Acció social
2012,G,16205,Assegurances
2012,G,16206,Ajuts a pensionistes de mutualitats de previsió
2012,G,16207,Acció social personal estaturi temporal
2012,G,16209,Altres despeses socials
2012,G,16300,Formació i perfeccionament del personal
2012,G,16301,Economats i menjadors
2012,G,16302,Transport de personal
2012,G,16304,Acció social
2012,G,16305,Assegurances
2012,G,16309,Altres despeses socials
2012,G,20200,Arrendaments d'edificis i d'altres construccions
2012,G,20300,Arrendaments maquinària instal·lacions i utillatge
2012,G,20301,Arrendaments i cànons maquinària
2012,G,20302,Arrendaments i cànons utillatge
2012,G,20400,Arrendaments de material de transport
2012,G,20500,Arrendaments de mobiliari i estris
2012,G,20600,Arrendaments d'equips per al procés d'informació
2012,G,20800,Arrendaments d'altre immobilitzat material
2012,G,20900,Cànons
2012,G,21000,D'infraestructura i béns naturals
2012,G,21200,D'edificis i d'altres construccions
2012,G,21300,"De maquinària, instal·lacions i utillatge"
2012,G,21301,Reparacions de maquinària
2012,G,21302,Reparacions utillatge
2012,G,21304,Reparacions d'aparells mèdico-assistencials
2012,G,21390,Manteniment de maquinària en arrendament
2012,G,21400,De material de transport
2012,G,21500,De mobiliari i estris
2012,G,21600,D'equips per a processos d'informació
2012,G,21900,D'altre immobilitzat material
2012,G,22000,Ordinari no inventariable
2012,G,22001,"Premsa, revistes i altres publicacions"
2012,G,22002,Material informàtic no inventariable
2012,G,22009,Altre material d'oficina
2012,G,22100,Energia elèctrica
2012,G,22101,Aigua
2012,G,22102,Gas
2012,G,22103,Combustibles
2012,G,22104,Vestuari
2012,G,22105,Productes alimentaris
2012,G,22106,Productes farmacèutics i material sanitari
2012,G,22108,"Material esportiu, didàctic i cultural"
2012,G,22109,Altres subministraments
2012,G,22110,Calçat
2012,G,22111,Altres productes alimentaris
2012,G,22113,Combustible per a vehicles
2012,G,22120,Antiinfecciosos
2012,G,22121,Antineoplàsics i immunomoduladors
2012,G,22122,Sang i òrgans hematopotètics
2012,G,22123,Fàrmacs del sistema nerviós central
2012,G,22124,fàrmacs del sistema musculoesquelètic
2012,G,22125,Fàrmacs de l'aparell digestiu i metabolisme
2012,G,22126,Fàrmacs de l'aparell cardiovascular
2012,G,22127,Altres fàrmacs i productes específics
2012,G,22128,Material de radiodiagnòstic
2012,G,22129,Material per a anàlisis
2012,G,22130,"Material quirúrgic, assistencial"
2012,G,22131,Material diàlisi
2012,G,22132,Reactius i anàlegs
2012,G,22133,Material d'ortopèdia
2012,G,22134,Gasos medicinals
2012,G,22135,Material medicina nuclear
2012,G,22136,Implants i osteosíntesis
2012,G,22137,Instrumental i petit utillatge ús sanitari
2012,G,22138,Material de banc de sang
2012,G,22140,Material repacions i conservació
2012,G,22141,Material de neteja
2012,G,22142,Instrumental i petit utillatge ús no sanitari
2012,G,22143,Neteja i endreç
2012,G,22199,Subministraments diversos
2012,G,22200,Telefòniques
2012,G,22209,Altres comunicacions
2012,G,22300,Transports
2012,G,22400,Primes d'assegurances
2012,G,22401,Assegurances d'incendis
2012,G,22402,Assegurances d'equips d'alta tecnologia
2012,G,22403,Assegurances d'elements de transport
2012,G,22404,Assegurances de responsabilitat civil
2012,G,22405,Altres assegurances
2012,G,22500,Tributs estatals
2012,G,22501,Tributs autonòmics
2012,G,22502,Tributs locals
2012,G,22601,Atencions protocol·làries i de representació
2012,G,22602,Publicitat i propaganda
2012,G,22603,Despeses jurídiques i contencioses
2012,G,22605,Assistència religiosa
2012,G,22606,"Reunions, conferències i cursos"
2012,G,22607,Oposicions i proves selectives
2012,G,22609,Altres despeses diverses
2012,G,22610,Altres serveis
2012,G,22700,Neteja i endreçament
2012,G,22701,Seguretat
2012,G,22703,Postals
2012,G,22704,"Custòdia, dipòsit i emmagatzematge"
2012,G,22706,Estudis i treballs tècnics
2012,G,22707,Bugaderia
2012,G,22708,Serveis de recaptació
2012,G,22709,Altres treballs
2012,G,22710,Serv. assist. prestats per prof: Tec. Sanitari.
2012,G,22711,Serv. assist. prestats. Altres empr.: Laboratoris
2012,G,22712,Restauració
2012,G,22713,Serv. No assist. prest. Altres emp.: Jardineria
2012,G,22714,Treb. no assist. prest. altres emp.:Mant. ascensor
2012,G,22715,Treballs no assit. per altres empreses:altres mant
2012,G,22716,Serv. assist. prestats. per prof.: Lic. Sanitaris
2012,G,22718,Serveis de professionals independents
2012,G,22719,Altres serveis de professionals independents
2012,G,22720,Gestió de residus
2012,G,22721,Prevenció de riscs laborals
2012,G,22722,Consultoria de sistemes d'informació
2012,G,22723,Consultoria de qualitat i medi ambient
2012,G,22724,Manteniment aparells sanitaris de Son Espases
2012,G,22999,Obligacions d'exercicis anteriors
2012,G,23000,"Dietes, locomoció i trasllats"
2012,G,23001,Locomoció
2012,G,23002,Trasllats
2012,G,23100,Assistències i pernoctes
2012,G,23900,Altres indemnitzacions
2012,G,25100,Concerts amb institucions d'atenció primària
2012,G,25101,Serveis concertats per a prevenció càncer mama
2012,G,25102,Serveis concertats Progr. Atenció Dental Infantil
2012,G,25200,Concerts amb institucions d'atenció especialitzada
2012,G,25213,Serveis assistencials. Policlínica Miramar
2012,G,25300,Concerts per a programes especials d'hemodiàlisi
2012,G,25301,Club de diàlisi
2012,G,25400,"Concerts amb serv.diagnòstic,tractament i teràpies"
2012,G,25401,Serveis assistencials. Clínica Rotger PET
2012,G,25402,Serveis assistencials Clínica Femenia RNM
2012,G,25403,Serveis assistencials. Clínica Femenia GRIP
2012,G,25404,Serveis assistencials. Clínica Palma Planas GRIP
2012,G,25405,Serveis assistencials. Càmara hiperbàrica
2012,G,25406,Concerts de teràpies respiratòries
2012,G,25407,Serveis concertats per a litotricies renals extracorp
2012,G,25408,Concerts de resonància nuclear magnètica
2012,G,25409,Altres tècniques de diagnòstic per imatge
2012,G,25410,Serveis concertats rehabilitació neuroreflexoterapia
2012,G,25411,Serveis assistencials Fundació Kovacs
2012,G,25412,Serveis assistencials Clínica Rotger Densiometria
2012,G,25413,Serveis assistencials. Oxigenoteràpia
2012,G,25414,Serveis assistencials. Aerosolteràpia
2012,G,25415,Serveis assistencials. Radioteràpia
2012,G,25416,Serveis assistencials de fisioteràpia a domicili
2012,G,25499,Altres concerts per a serveis especials
2012,G,25500,Concerts per al transport sanitari terrestre
2012,G,25501,Concerts per al transport sanitari aeri
2012,G,25800,Assistència sanitària prestada per tercers
2012,G,25900,Altres serveis d'assistència sanitària
2012,G,31000,Interessos
2012,G,31009,"Interessos, préstecs a curt termini"
2012,G,31090,Interessos d'altres préstecs
2012,G,31100,"Despeses formalització, modificació i cancel·lació"
2012,G,31900,Altres despeses financeres
2012,G,33000,Interessos
2012,G,33100,"Despeses formalització, modificació i cancel·lació"
2012,G,33200,diferències de canvi
2012,G,33900,Altres despeses financeres
2012,G,34000,Interessos de dipòsits
2012,G,34100,Interessos de fiances
2012,G,35200,Interessos de demora
2012,G,35900,Altres despeses financeres
2012,G,35990,Interessos arrend.financer opció compra (leasing)
2012,G,44421,Fundació Banc de Sang i Teixits Illes Balears
2012,G,44423,Fundació Investigació Sanitària IB Ramon Llull
2012,G,48000,A famílies i institucions sense finalitat lucrativ
2012,G,48604,Entregues per desplaçament (Particulars)
2012,G,48605,Entregues per desplaçament
2012,G,48606,Pròtesis
2012,G,48607,Vehicles per a minusvàlids
2012,G,48900,Receptes mèdiques
2012,G,48910,Reintegrament de despeses de farmàcia
2012,G,48911,Reintegrament despeses farmàcia disp.ambulatòria
2012,G,48920,Efectes i accessoris
2012,G,48921,Vacunes
2012,G,48922,Tires reactives
2012,G,48923,Medicaments estrangers
2012,G,48924,Farmacioles d'empresa
2012,G,48990,Altres despeses de farmàcia
2012,G,48999,Receptes mèdiques d'exercicis anteriors
2012,G,60000,Terrenys i béns naturals
2012,G,60100,Infraestructura i béns destinats a l'ús general
2012,G,60900,Altres inversions
2012,G,61000,Terrenys i béns naturals
2012,G,61100,Infraestructura i béns destinats a l'ús general
2012,G,61900,Altres inversions
2012,G,62000,Terrenys i béns naturals
2012,G,62200,Edificis i altres construccions
2012,G,62201,Construccions noves en curs
2012,G,62202,Construccions
2012,G,62302,Maquinària
2012,G,62303,Utillatge
2012,G,62304,Equips i aparells medicoassistencials
2012,G,62305,Equips i aparells medicoassistencials en muntatge
2012,G,62306,Instal·lacions tècniques
2012,G,62400,Elements de transport
2012,G,62500,Mobiliari i estris
2012,G,62501,Equips d'oficina i electrodomèstics
2012,G,62502,Mobiliari
2012,G,62600,Equips per a processos d'informació
2012,G,62900,Altre immobilitzat material
2012,G,63000,Terrenys i béns naturals
2012,G,63200,Edificis i altres construccions
2012,G,63201,Construccions de reposició en curs
2012,G,63202,Construccions
2012,G,63302,Maquinària
2012,G,63303,Utillatge
2012,G,63304,Equips i aparells medicoassistencials
2012,G,63306,Instal·lacions tècniques
2012,G,63400,Elements de transport
2012,G,63500,Mobiliari i estris
2012,G,63501,Equips d'oficina i electrodomèstics
2012,G,63502,Mobiliari
2012,G,63600,Equips per a processos d'informació
2012,G,63900,Altre immobilitzat material
2012,G,64000,Despeses en inversions de caràcter immaterial
2012,G,64003,Projectes I+D
2012,G,64005,Propietat intel·lectual
2012,G,64006,Aplicacions informàtiques
2012,G,64007,Propietat intel·lectual
2012,G,64008,Altre immobilitzat immaterial
2012,G,64016,Aplicacions informàtiques en curs
2012,G,64090,Arrendament financer opció compra (leasing)
2012,G,74300,A consorcis participats per la Comunitat Autònoma
2012,G,74421,Fundació Banc de Sang i Teixits Illes Balears
2012,G,74423,Fundació Investigació Sanitària IB Ramon Llull
2012,G,75000,A la CAIB
2012,G,78000,A famílies i institucions sense finalitat lucrativ
2012,G,83007,A empreses privades
2012,G,83008,A famílies i instituc. sense finalitat lucrativa
2012,G,83009,A l'exterior
2012,G,83107,A empreses privades
2012,G,83108,A famílies i instituc. sense finalitat lucrativa
2012,G,83109,A l'exterior
2012,G,84000,Constitució de dipòsits a curt termini
2012,G,84001,Constitució de dipòsits a llarg termini
2012,G,84100,Constitució de fiances a curt termini
2012,G,84101,Constitució de fiances a llarg termini
2012,G,87100,Aportacions patrimonials
2012,G,91000,Amortització de préstecs a curt termini d'ens s.p.
2012,G,91100,Amortització de préstecs llarg termini d'ens s.púb
2012,G,91200,Amortització préstecs curt termini ens fora s.púb.
2012,G,91300,Amortització préstecs llarg termini ens fora s.púb
2012,G,93000,Amortització de préstecs de l'exterior a curt term
2012,G,93100,Amortització de préstecs de l'exterior a llarg ter
2012,G,94000,Devolució de dipòsits
2012,G,94100,Devolució de fiances
2012,G,1,Despeses de personal
2012,G,2,Despeses corrents en béns i serveis
2012,G,3,Despeses financeres
2012,G,4,Transferències corrents
2012,G,5,Fons de contingència
2012,G,6,Inversions reals
2012,G,7,Transferències de capital
2012,G,8,Actius financers
2012,G,9,Passius financers
2012,G,10,Despeses de personal: retribucions d'alts càrrecs
2012,G,11,Despeses de personal: retribucions del personal eventual
2012,G,12,Despeses de personal: retribucions de funcionaris i personal estatutari
2012,G,13,Despeses de personal: retribucions personal laboral
2012,G,14,Despeses de personal: altre personal
2012,G,15,Despeses de personal: incentius al rendiment
2012,G,16,"Despeses de personal: quotes, prestacions i desp.socials a càrrec ocupador"
2012,G,20,Arrendaments i cànons
2012,G,21,"Reparacions, manteniment i conservació"
2012,G,22,"Material, subministraments i altres"
2012,G,23,Indemnitzacions per raó del servei
2012,G,24,Serveis nous
2012,G,26,Concerts per a la prestació de serveis socials
2012,G,30,Despeses financeres de deute públic en euros
