2012,I,30949,Per realització informes ordenació territori i urbanisme
2012,I,30950,Per autoritzacions en matèria de policia mortuòria
2012,I,30951,Per inscripcions i anotacions al Registre Sanitari
2012,I,30952,"Per autoritzacions de centres,establiments i serveis sanitaris"
2012,I,30953,Per control sanitari entitats d'assegurança medicofarmaceútica
2012,I,30954,Per control sanitari de les piscines d'ús públic
2012,I,30955,Per acreditació laboratoris en matèria de consum
2012,I,30956,Per control sanitari dels menjadors col·lectius
2012,I,30957,Per autorització instal·lació o trasllat of.farmàcia
2012,I,30958,Per altres actuacions sanitàries
2012,I,30959,Per serveis del laboratori de salut pública
2012,I,30960,Per realització d'assaigs clínics amb medicaments
2012,I,30961,Per control sanitari d'animals i els seus productes
2012,I,30962,Per control sanitari dels productes pesquers
2012,I,30963,Per llicències per caçar a vedats socials i precintes d'arts per a la caça
2012,I,30964,"Per matrícula anual vedats caça, ensinistraments de cans"
2012,I,30965,Per llicències pesca fluvial i segell recàrrec
2012,I,30966,Per llicències de pesca
2012,I,30967,Per celebració de campionats de pesca
2012,I,30968,"Per ordenació i defensa indústries agrícoles, forestals i pecuàries"
2012,I,30969,Per serveis gestió tecnicofacultativa serveis agronòmics
2012,I,30970,Per serveis facultatius veterinaris
2012,I,30971,Per serveis industrials i d'energia
2012,I,30972,"Per serveis en matèria d'aigües, mines i voladures"
2012,I,30973,Per serveis administratius
2012,I,30974,Per llicència autonòmica gran establiment comercial
2012,I,30975,"Per amarratges,hivernades i estada a Calanova"
2012,I,30976,Per tramitació sol·licitud concessió etiqueta ecològica
2012,I,30977,Per la utilització de l'etiqueta ecològica
2012,I,30979,Per la inscripció en els registres d'emergències
2012,I,30980,Per autorització d'entitats formadores
2012,I,30981,Per declaració d'interès sanitari
2012,I,30982,Per registre d'entitats formadores manipuladors aliments
2012,I,30983,Per registre d'activitats carnisseria i xarcuteria
2012,I,30984,Per reconeixement de títols a ciutadans de la UE
2012,I,30985,Per registre entitats formadores ús desfibril·ladors
2012,I,30986,Inscripció d'empreses serveis biocides/plaguicides
2012,I,30987,Per supervisió d'instal·lacions d'aigua de consum humà
2012,I,30988,Per la inscripció en el Registre de Mediadors
2012,I,30989,Taxa per sol·licitud revisió grau de discapacitat
2012,I,30990,Taxa per sol·lcitud revisió grau de dependència
2012,I,30991,Taxa per serveis del Registre de parelles estables
2012,I,30992,Taxa per serveis administratius generals del SOIB
2012,I,30993,Taxa per actuacions administratives espècies silvestres
2012,I,30994,Taxa per autorització treballs subaquàtics
2012,I,30995,Taxa autorització canvi de port base i ús temporal
2012,I,30996,Taxa expedició certificació professionalitat pesquera
2012,I,30997,Per acreditació activitats formació professions sanitàries
2012,I,30999,Altres taxes
2012,I,31900,"Preu públic assist.sanitària, pagament al comptat"
2012,I,31901,"Preu públic assist.sanitària, asseguradores privad"
2012,I,31902,"Preu públic assist.sanitària, particulars"
2012,I,31903,"Preu públic assist.sanitària, accidents de treball"
2012,I,31904,"Preu públic assist.sanitària, acc.trànsit UNESPA"
2012,I,31905,"Preu públic assist.sanitària, empr.col·lab. Seg.So"
2012,I,31908,Assist. sanit. mutues asseg. escolars i esportives
2012,I,31909,Assist. sanitària corporacions locals
2012,I,31910,Assist. sanit. a altres ens i organismes públics
2012,I,31916,Assist. sanitària INSS
2012,I,31917,Assistència sanitària accidents de trànsit
2012,I,31918,Quotes conveni especial assistència sanitària
2012,I,31919,Dispensació famacèutica ambulatòria a hospitals
2012,I,32700,Altres ingr. procedents de l'assistència sanitària
2012,I,32701,Prestació assistència sanitària accidents treball
2012,I,32703,Prestació assist. sanitària entitats asseg. Privades
2012,I,32704,Prestació assist. sanit. empreses col. Seg. Soc
2012,I,32705,Prestació assistència sanitària INSS
2012,I,32706,Prest. assist. sanit. mutues acc. escolar i esport
2012,I,32707,Prestació assist. sanit. IBSA contracte programa
2012,I,32709,Prest. assist. sanit. entitats vinc. servei salut
2012,I,32710,Prest. assist. sanit. entitats vinculades a CAIB
2012,I,32711,Prestació assist. sanitària Corporacions Locals
2012,I,32712,Prestació assistència sanitària tràfics
2012,I,32713,Prest. assist. sanit. altres entitats i org. públ.
2012,I,32761,Facturació per assistència sanitaria
2012,I,32762,Facturació per assistència sanitaria
2012,I,32763,Facturació per assistència sanitaria
2012,I,32764,Facturació per assistència sanitaria
2012,I,32799,Prestació assistència sanitària per incorp. deute
2012,I,32910,Drets de matrícula a cursos i seminaris
2012,I,32920,"Entrades a museus, exposicions, espectacles, etc."
2012,I,32930,"Drets d'allotjament, restauració i residència"
2012,I,32999,Altres ingressos procedents de la prest.serveis
2012,I,33001,"Venda, publicació i anuncis del BOIB"
2012,I,33099,Venda d'altres publicacions
2012,I,33100,Venda en comissió de publicacions
2012,I,33200,Venda de fotocòpies i d'altres productes de reprog
2012,I,33300,Venda de medicaments
2012,I,33400,Venda de productes agropecuaris
2012,I,33500,Venda de material de rebuig
2012,I,33900,Venda d'altres béns
2012,I,33901,Venda d'impresos
2012,I,38000,Reintegraments d'exercicis tancats
2012,I,38100,Reintegraments del pressupost corrent
2012,I,38101,Reintegraments de romanents de pag. a justificar
2012,I,39100,Recàrrecs de constrenyiment
2012,I,39101,Interessos de demora
2012,I,39102,Multes i sancions
2012,I,39103,Recàrrec sobre autoliquidacions
2012,I,39199,Altres recàrrecs i multes
2012,I,39900,Compensació de serveis realitzats per funcionaris
2012,I,39901,Recursos eventuals
2012,I,39905,Ingressos per costes processals
2012,I,39906,Retribucions recaptació
2012,I,39999,Altres ingressos diversos
2012,I,40000,transferències corrents de l'Administració General de l'Estat
2012,I,40001,Fons de garantia
2012,I,40002,Fons de suficiència
2012,I,40003,Fons de convergència
2012,I,40008,Bestretes per ajornament devol. liquid. negatives
2012,I,40009,Liquidació d'exercicis anteriors
2012,I,40060,"Transferències corrents de l'AGE: Fons cohesió sanitat, assist.desplaçats"
2012,I,40100,Transferències corrents d'organismes autònoms estatals
2012,I,40101,Transferències corrents del Servicio Público de Empleo (INEM)
2012,I,40200,Transferències corrents de la Seguretat Social
2012,I,40201,Transferències corrents de l'Instituto de Migraciones y Servicios Sociales
2012,I,40260,"Transferències corrents de la SS, programa d'estalvi Incapacitat Temporal"
2012,I,40261,"Transferències corrents de la SS, assistència sanitària desplaçats"
2012,I,40300,Transferències corrents de fundacions estatals
2012,I,40400,"Transferències corrents de soc.merc.estatals,ent.empresarials i altres ens"
2012,I,44100,Transferències corrents d'empreses pub. no soc. i d'altres EP de la CAIB
2012,I,45100,Transferències corrents d'altres comunitats autònomes
2012,I,46000,Transferències corrents d'ajuntaments
2012,I,46100,Transferències corrents de consells insulars
2012,I,46400,Transferències corrents d'empr.públiques i altres ens públics de corp.loc.
2012,I,46900,Transferències corrents d'altres ens territorials
2012,I,47000,Transferències corrents d'empreses privades
2012,I,48000,Transferències corrents de famílies i institucions sense finalitat lucrati
2012,I,49000,Transferències corrents del Fons Social Europeu
2012,I,49200,Altres transferències de la Unió Europea
2012,I,49900,Altres transferències de l'exterior
2012,I,50000,Interessos de títols i valors de l'Estat
2012,I,50010,Interessos de títols i valors d'organismes autònoms
2012,I,50040,"Interessos de títols i valors de soc.merc.estatals,ent.empresarials i altres ens"
2012,I,50100,Interessos de títols i valors d'entitats autònomes de caràcter administratiu
2012,I,50400,Interessos de títols i valors d'empreses públiques i d'altres ens públics
2012,I,50500,Interessos de títols i valors de la comunitat autònoma de les Illes Balears
2012,I,50510,Interessos de títols i valors d'altres comunitats autònomes
2012,I,50600,Interessos de títols i valors de corporacions locals d'altres ens territorials
2012,I,50700,Interessos de títols i valors d'empreses privades
2012,I,51000,Interessos de bestretes i préstecs concedits a l'Administració General
2012,I,51010,Interessos de bestretes i préstecs concedits a organismes autònoms
2012,I,51040,"Interessos de bestretes i préstecs concedits a soc.merc.estatals,ent.empresarials i altres org."
2012,I,51100,Interessos de bestretes i préstecs concedits a entitats autònomes de caràcter administratiu
2012,I,51400,Interessos de bestretes i préstecs concedits a empreses públiques i altres ens públics
2012,I,51500,Interessos de bestretes i préstecs concedits a la comunitat autònoma de les Illes Balears
2012,I,51510,Interessos de bestretes i préstecs concedits a altres comunitats autònomes
2012,I,51600,Interessos de bestretes i préstecs concedits a corporacions locals i altres ens territorials
2012,I,51700,Interessos de bestretes i préstecs concedits a empreses privades
2012,I,51800,Interessos de bestretes i préstecs concedits a famílies i institucions sense finalitat lucrativ
2012,I,51900,Interessos de bestretes i préstecs concedits a l'exterior
2012,I,52000,Interessos de consignacions judicials
2012,I,52099,Altres interessos de comptes bancaris
2012,I,52900,Interessos d'altres dipòsits
2012,I,53400,Dividends i participació en beneficis d'empreses publiques i d'altres ens públics
2012,I,53700,Dividends i participació en beneficis d'empreses privades
2012,I,54000,Lloguers d'habitatges
2012,I,54001,Lloguers de locals
2012,I,54002,Lloguers d'edificis en general
2012,I,54099,Altres productes d'immobles
2012,I,54100,Lloguers de finques rústiques
2012,I,54900,Altres rendes de béns immobles
2012,I,55000,Productes de concessions administratives
2012,I,55100,Aprofitaments agrícoles i forestals
2012,I,55900,Altres concessions i aprofitaments
2012,I,57000,Resultat d'operacions comercials
2012,I,58000,Variació del fons de maniobra
2012,I,59000,Cànon d'arrendament d'emissores locals
2012,I,59100,Beneficis per la realització inversions financeres
2012,I,59200,Comissions sobre avals
2012,I,59300,Interessos d'operacions de cobertura de risc
2012,I,59900,Altres ingressos patrimonials
2012,I,60000,Alienació de solars
2012,I,60100,Alienació de finques rústiques
2012,I,61900,Alienació d'altres inversions reals
2012,I,68000,Reintegraments d'exercicis tancats
2012,I,68100,Reintegraments de l'exercici corrent
2012,I,70000,Transferències de capital de l'Administració General
2012,I,70100,Transferències de capital d'organismes autònoms estatals
2012,I,70101,Transferències de capital del Servicio Público de Empleo (INEM)
2012,I,70200,Transferències de capital de la Seguretat Social
2012,I,70201,Transferències de capital de l'Instituto de Migraciones y Servicios Sociales
2012,I,70300,Transferències de capital de fundacions estatals
2012,I,70400,"Transferències de capital de soc.merc.estatals,ent.empresarials i altres ens"
2012,I,72000,Transferències de capital del Servei de Salut de les Illes Balears
2012,I,74300,Transferències de capital de consorcis en què participa la C. Autònoma
2012,I,75100,Transferències de capital d'altres comunitats autònomes
2012,I,76000,Transferències de capital d'ajuntaments
2012,I,76110,Transferències de capital del Consell Insular de Mallorca
2012,I,76120,Transferències de capital del Consell Insular de Menorca
2012,I,76130,Transferències de capital del Consell Insular d'Eivissa
2012,I,76140,Transferències de capital del Consell Insular de Formentera
2012,I,76400,Transferències de capital d'empreses públiques i altres ens de corp.locals
2012,I,76900,Transferències de capital d'altres ens territorials
2012,I,77000,Transferències de capital d'empreses privades
2012,I,78000,Transferències de capital de famílies i institucions sense finalitat lucrati
2012,I,79000,Transferències de capital del Fons Europeu de Desenvolupament Regional
2012,I,79100,Transferències de capital de l'Instrument Financer de Cohesió
2012,I,79101,Transferències de capital del Fons de Cohesió
2012,I,79200,Transferències de capital del FEOGA-Orientació
2012,I,79201,Transferències de capital del FEOGA-Garantia
2012,I,79202,Transferències de capital del Fons Europeu Agrícola de Garantia - FEAGA
2012,I,79203,Transferències de capital del Fons Europeu Agrícola de Desenvolupament Rural
2012,I,79400,Transferències de capital del Fons Social Europeu
2012,I,79500,Transferències de capital de l'Instrument Financer Ordenació de la Pesca
2012,I,79501,Transferències de capital del Fons Europeu de Pesca - FEP
2012,I,79600,Altres transferències de la UE
2012,I,79900,Altres transferències de l'exterior
2012,I,80000,Alienació de deute del sector públic de l'administració de l'Estat a curt termini 
2012,I,80001,Alienació del deute d'organismes autònoms de caràcter administratiu a curt termini
2012,I,80002,Alienació del deute de la Seguretat Social a curt termini
2012,I,80003,"Alienació del deute d'organismes autònoms de caràcter comercial, industrials, etc a curt termini"
2012,I,80004,Alienació del deute d'empreses públiques i d'altres ens públics a curt termini
2012,I,80005,Alienació del deute de comunitats autònomes a curt termini
2012,I,80006,Alienació del deute de corporacions locals a curt termini
2012,I,80100,Alienació de deute del sector públic de l'administració de l'Estat a llarg termini 
2012,I,80101,Alienació del deute d'organismes autònoms de caràcter administratiu a llarg termini
2012,I,80102,Alienació del deute de la Seguretat Social a llarg termini
2012,I,80103,"Alienació del deute d'organismes autònoms de caràcter comercial, industrials, etc a llarg termini"
2012,I,80104,Alienació del deute d'empreses públiques i d'altres ens públics a llarg termini
2012,I,80105,Alienació del deute de comunitats autònomes a llarg termini
2012,I,80106,Alienació del deute de corporacions locals a llarg termini
2012,I,81007,Alienació d'obligacions i bons d'empreses privades a curt termini
2012,I,81008,Alienació d'obligacions i bons de famílies i institucions sense finalitat lucrativa a curt termini
2012,I,81009,Alienació d'obligacions i bons de l'exterior a curt termini
2012,I,81107,Alienació d'obligacions i bons  d'empreses privades a llarg termini
2012,I,81108,Alienació d'obligacions i bons de famílies i institucions sense finalitat lucrativa a llarg termini
2012,I,81109,Alienació d'obligacions i bons de l'exterior a llarg termini
2012,I,82000,Reintegraments de préstecs conceditsa l'administració de l'Estat a curt termini
2012,I,82001,Reintegraments de préstecs concedits a organismes autònoms de caràcter administratiu a curt termini
2012,I,82002,Reintegraments de préstecs concedits a la Seguretat Social a curt termini
2012,I,82003,"Reintegraments de préstecs concedits a organismes autònoms de caràcter comercial, indus a curt termini"
2012,I,82004,Reintegraments de préstecs concedits a empreses públiques i altres ens públics a curt termini
2012,I,82005,Reintegraments de préstecs concedits a comunitats autònomes a curt termini
2012,I,82006,Reintegraments de préstecs concedits a corporacions locals a curt termini
2012,I,82007,Reintegraments de préstecs concedits a empreses vinculades i altres ens participats CAIB a curt termini
2012,I,82100,Reintegraments de préstecs concedits a l'administració de l'Estat a llarg termini
2012,I,82101,Reintegraments de préstecs concedits a organismes autònoms de caràcter administratiu a llarg termini
2012,I,82102,Reintegraments de préstecs concedits a la Seguretat Social a llarg termini
2012,I,82103,"Reintegraments de préstecs concedits a organismes autònoms de caràcter comercial, indus a llarg termini"
2012,I,82104,Reintegraments de préstecs concedits a empreses públiques i altres ens públics a llarg termini
2012,I,82105,Reintegraments de préstecs concedits a comunitats autònomes a llarg termini
2012,I,82106,Reintegraments de préstecs concedits a corporacions locals a llarg termini
2012,I,83007,Reintegraments de préstecs concedits a empreses privades a curt termini
2012,I,83008,Reintegraments de préstecs concedits a famílies i institucions sense finalitat de lucre a curt termini
2012,I,83009,Reintegraments de préstecs concedits a l'exterior a curt termini
2012,I,83107,Reintegraments de préstecs concedits a empreses privades a llarg termini
2012,I,83108,Reintegraments de préstecs concedits a famílies i institucions sense finalitat de lucre a llarg termini
2012,I,83109,Reintegraments de préstecs concedits a l'exterior a llarg termini
2012,I,84000,Devolució de dipòsits
2012,I,84100,Devolució de fiances
2012,I,85000,Alienació d'accions i participacions del sector públic estatal
2012,I,85100,Alienació d'accions i participacions del sector públic de la CAIB
2012,I,85200,Alienació d'accions i participacions del sector públic d'altres comunitats autònomes
2012,I,85300,Alienació d'accions i participacions del sector públic de corporacions locals
2012,I,86000,Alienació d'accions i participacions de fora del sector públic d'empreses nacionals o de la UE
2012,I,86100,Alienació d'accions i participacions de fora del sector públic d'altres empreses
2012,I,87000,Romanents de tresoreria
2012,I,87001,Finançament d'incorporacions de crèdit
2012,I,87002,Finançament d'ampliacions de crèdit
2012,I,87003,Finançament d'incorporacions per aplicació de romanents
2012,I,90000,Emissió de deute públic en euros a curt termini
2012,I,90100,Emissió de deute públic en euros a llarg termini
2012,I,91000,Préstecs rebuts en euros d'ens del sector públic a curt termini 
2012,I,91100,Préstecs rebuts en euros d'ens del sector públic a llarg termini 
2012,I,91200,Préstec rebuts d'ens que no pertanyen sector públic a curt termini
2012,I,91300,Préstec rebuts d'ens que no pertanyen sector públic a llarg termini
2012,I,92000,Emissió de deute públic en divises a curt termini
2012,I,92100,Emissió de deute públic en divises a llarg termini
2012,I,93000,Préstecs rebuts en divises a curt termini
2012,I,93100,Préstecs rebuts en divises a llarg termini
2012,I,94000,Dipòsits rebuts
2012,I,94100,Fiances rebudes
2012,I,1,Imposts directes
2012,I,2,Imposts indirectes
2012,I,3,"Taxes, prestació de serveis i altres ingressos"
2012,I,4,Transferències corrents
2012,I,5,Ingressos patrimonials
2012,I,6,Alienació d'inversions reals
2012,I,7,Transferències de capital
2012,I,8,Actius financers
2012,I,9,Passius financers
2012,I,10,Impost sobre la renda
2012,I,11,Imposts directes sobre el capital
2012,I,20,Transmisions patrimonials i actes jurídics documentats
2012,I,21,Impost sobre el valor afegit
2012,I,22,Imposts sobre consums específics
2012,I,28,Altres imposts indirectes
2012,I,29,Imposts indirectes extingits
2012,I,30,Taxes
2012,I,32,Altres ingressos procedents de la prestació de serveis
2012,I,33,Venda de béns
2012,I,38,Reintegraments d'operacions corrents
2012,I,39,Altres ingressos
2012,I,40,transferències corrents de l'Administració de l'Estat
2012,I,42,Transferències corrents del Servei de Salut de les Illes Balears
2012,I,44,Transferències corrents del sector públic instrumental i altres ens
2012,I,45,Transferències corrents de comunitats autònomes
2012,I,46,Transferències corrents de corporacions locals
2012,I,47,Transferències corrents d'empreses privades
2012,I,48,Transferències corrents de famílies i institucions sense finalitat lucrativa
2012,I,49,Transferències corrents de l'exterior
2012,I,50,Interessos de títols i valors
2012,I,51,Interessos de bestretes i préstecs concedits
2012,I,52,Interessos de dipòsits
2012,I,53,Dividends i participació en beneficis
2012,I,54,Rendes de béns immobles
2012,I,55,Productes de concessions i aprofitaments especials
2012,I,57,Resultat d'operacions comercials
2012,I,58,Variació del fons de maniobra
2012,I,59,Altres ingressos patrimonials
2012,I,60,Alienació de terrenys
2012,I,61,Alienació d'altres inversions reals
2012,I,68,Reintegraments d'operacions de capital
2012,I,70,Transferències de capital de l'Administració de l'Estat
2012,I,72,Transferències de capital del Servei de Salut de les Illes Balears
2012,I,74,Transferències de capital del sector públic instrumental i altres ens
2012,I,75,Transferències de capital de comunitats autònomes
2012,I,76,Transferències de capital de corporacions locals
2012,I,77,Transferències de capital d'empreses privades
2012,I,78,Transferències de capital de famílies i institucions sense finalitat lucrativa
2012,I,79,Transferències de capital de l'exterior
2012,I,80,Alienació de deute del sector públic
2012,I,81,Alienació d'obligacions i bons de fora del sector públic
2012,I,82,Reintegraments de préstecs concedits al sector púbic
2012,I,83,Reintegraments de préstecs concedits fora del sector públic
2012,I,84,Devolució de dipòsits i fiances
2012,I,85,Alienació d'accions i participacions del sector públic
2012,I,86,Alienació d'accions i participacions de fora del sector públic
2012,I,87,Romanents de tresoreria
2012,I,90,Emissió de deute públic en euros
2012,I,91,Préstecs rebuts en euros
2012,I,92,Emissió de deute públic en divises
2012,I,93,Préstecs rebuts en divises
2012,I,94,Dipòsits i fiances rebuts
2012,I,100,Impost sobre la renda de les persones físiques
2012,I,110,Impost general sobre successions i donacions
2012,I,111,Impost sobre el patrimoni de les persones físiques
2012,I,112,Impost sobre dipòsits en entitats de crèdit
2012,I,200,"Impost sobre transmissions ""inter vivos"""
2012,I,201,Impost sobre actes jurídics documentats
2012,I,210,Impost sobre el valor afegit
2012,I,220,Imposts especials
2012,I,281,Impost sobre estades turístiques i turisme sostenible
2012,I,282,Impost sobre el joc
2012,I,283,Cànon de sanejament d'aigües
2012,I,300,Taxes de joc
2012,I,301,Taxes i cànons per l'ordenació de les telecomunicacions
2012,I,302,Taxes per direcció i inspecció d'obres
2012,I,303,"Taxes acadèmiques, drets matrícula, exped.títols"
2012,I,309,Altres taxes
2012,I,320,Comissions per avals i assegurances en operacions
2012,I,322,Altres ingressos derivats de la prestació de serveis
2012,I,329,Altres ingressos derivats de la prestació de serveis
2012,I,330,Venda de publicacions pròpies
2012,I,331,Venda de publicacions en comissió
2012,I,332,Venda de fotocòpies i d'altres productes de reprografia
2012,I,333,Venda de medicaments
2012,I,334,Venda de productes agropecuaris
2012,I,335,Venda de material de rebuig
2012,I,339,Venda d'altres béns
2012,I,380,Reintegraments d'exercicis tancats
2012,I,381,Reintegraments del pressupost corrent
2012,I,391,Recàrrecs i multes
2012,I,392,Diferències de canvi
2012,I,393,Diferències entre el valor de reembossament i emissió
2012,I,399,Ingressos diversos
2012,I,400,Transferències corrents de l'Administració General de l'Estat
2012,I,401,Transferències corrents d'organismes autònoms estatals
2012,I,402,Transferències corrents de la Seguretat Social
2012,I,403,Transferències corrents de fundacions estatals
2012,I,404,"De soc.merc.estatals,ent.empresarials i altres ens"
2012,I,420,Transferències corrents del Servei de Salut de les Illes Balears
2012,I,440,Transferències corrents de societats públiques mercantils
2012,I,441,Transferències corrents d'entitats públiques empresarials i altres ens púb
2012,I,442,Transferències corrents d'empreses i altres ens participats
2012,I,443,Transferències corrents de consorcis en què participa la com.autònoma
2012,I,444,Transferències corrents de fundacions del sector públic
2012,I,445,Transferències corrents d'altres fundacions en que participa la Com.Autòn.
2012,I,451,Transferències corrents d'altres comunitats autònomes
2012,I,460,Transferències corrents d'ajuntaments
2012,I,461,Transferències corrents de consells insulars
2012,I,464,Transferències corrents d'empr.públiques i altres ens públics de corp.loc.
2012,I,469,Transferències corrents d'altres ens territorials
2012,I,470,Transferències corrents d'empreses privades
2012,I,480,Transferències corrents de famílies i institucions sense finalitat lucrativa
2012,I,490,Transferències corrents del Fons Social Europeu
2012,I,492,Altres transferències de la Unió Europea
2012,I,499,Altres transferències de l'exterior
2012,I,500,Interessos de títols i valors de l'Administració de l'Estat
2012,I,501,Interessos de títols i valors d'entitats autònomes
2012,I,504,Interessos de títols i valors d'empreses públiques i d'altres ens públics
2012,I,505,Interessos de títols i valors de comunitats autònomes
2012,I,506,Interessos de títols i valors de corporacions locals i altres ens territorials
2012,I,507,Interessos de títols i valors d'empreses privades
2012,I,510,Interessos de bestretes i préstecs concedits a l'administració de l'Estat
2012,I,511,Interessos de bestretes i préstecs concedits a entitats autònomes
2012,I,514,Interessos de bestretes i préstecs concedits a empreses públiques i altres ens públics CAIB
2012,I,515,Interessos de bestretes i préstecs concedits a comunitats autònomes
2012,I,516,Interessos de bestretes i préstecs concedits a corporacions locals i altres ens territorials
2012,I,517,Interessos de bestretes i préstecs concedits a empreses privades
2012,I,518,Interessos de bestretes i préstecs concedits a famílies i institucions sense finalitat de lucre
2012,I,519,Interessos de bestretes i préstecs concedits a l'exterior
