2012,I,85100,Alienació d'accions i participacions del sector públic de la CAIB
2012,I,85200,Alienació d'accions i participacions del sector públic d'altres comunitats autònomes
2012,I,85300,Alienació d'accions i participacions del sector públic de corporacions locals
2012,I,86000,Alienació d'accions i participacions de fora del sector públic d'empreses nacionals o de la UE
2012,I,86100,Alienació d'accions i participacions de fora del sector públic d'altres empreses
2012,I,87000,Romanents de tresoreria
2012,I,87001,Finançament d'incorporacions de crèdit
2012,I,87002,Finançament d'ampliacions de crèdit
2012,I,87003,Finançament d'incorporacions per aplicació de romanents
2012,I,90000,Emissió de deute públic en euros a curt termini
2012,I,90100,Emissió de deute públic en euros a llarg termini
2012,I,91000,Préstecs rebuts en euros d'ens del sector públic a curt termini 
2012,I,91100,Préstecs rebuts en euros d'ens del sector públic a llarg termini 
2012,I,91200,Préstec rebuts d'ens que no pertanyen sector públic a curt termini
2012,I,91300,Préstec rebuts d'ens que no pertanyen sector públic a llarg termini
2012,I,92000,Emissió de deute públic en divises a curt termini
2012,I,92100,Emissió de deute públic en divises a llarg termini
2012,I,93000,Préstecs rebuts en divises a curt termini
2012,I,93100,Préstecs rebuts en divises a llarg termini
2012,I,94000,Dipòsits rebuts
2012,I,94100,Fiances rebudes
2012,I,39996,Ingressos per anuncis de concursos,Ingresos por anuncios de concursos
2012,I,39998,Ingressos per resolucions judicials,Ingresos por resoluciones judiciales
2012,I,44400,De fundacions en que participa la Comunitat Autònoma IB,De fundaciones en que participa la Comunitat Autónoma IB
2012,I,55001,"Ingressos de cafeteries, llibreries i aparells de TV","Ingresos de cafeterías, librerías y aparatos de TV"
2012,I,28400,Impost sobre danys mediambiental causats per vehicles de lloguer,Impuesto sobre daños medioambientales causados por vehículos de alquiler
2012,I,28500,Impost sobre danys mediambientals causats per grans superfícies...,Impuesto sobre daños medioambientales causados por grandes superficies...
2012,I,28600,Impost sobre envasos de begudes,Impuesto sobre envases de bebidas
2012,G,1,Despeses de personal
2012,G,2,Despeses corrents en béns i serveis
2012,G,3,Despeses financeres
2012,G,4,Transferències corrents
2012,G,5,Fons de contingència
2012,G,6,Inversions reals
2012,G,7,Transferències de capital
2012,G,8,Actius financers
2012,G,9,Passius financers
2012,G,10,Despeses de personal: retribucions d'alts càrrecs
2012,G,11,Despeses de personal: retribucions del personal eventual
2012,G,12,Despeses de personal: retribucions de funcionaris i personal estatutari
2012,G,13,Despeses de personal: retribucions personal laboral
2012,G,14,Despeses de personal: altre personal
2012,G,15,Despeses de personal: incentius al rendiment
2012,G,16,"Despeses de personal: quotes, prestacions i desp.socials a càrrec ocupador"
2012,G,20,Arrendaments i cànons
2012,G,21,"Reparacions, manteniment i conservació"
2012,G,22,"Material, subministraments i altres"
2012,G,23,Indemnitzacions per raó del servei
2012,G,24,Serveis nous
2012,G,26,Concerts per a la prestació de serveis socials
2012,G,30,Despeses financeres de deute públic en euros
2012,G,31,Despeses financeres de préstecs en euros
2012,G,32,Despeses financeres de deute públic en divises
2012,G,33,Despeses financeres de préstecs en divises
2012,G,34,Despeses financeres de dipòsits i fiances
2012,G,35,Interessos de demora i altres despeses financeres
2012,G,40,Transfere`ncies corrents a l'Administració de l'Estat
2012,G,42,Transferències corrents al Servei de Salut de les Illes Balears
2012,G,44,Transferències corrents al sector públic instrumental i altres ens sec.púb
2012,G,45,Transferències corrents a comunitats autònomes
2012,G,46,Transferències corrents a corporacions locals
2012,G,47,Transferències corrents a empreses privades
2012,G,48,Transferències corrents a famílies i institucions sense ànim de lucre
2012,G,49,Transferències corrents a l'exterior
2012,G,50,Fons de contingència
2012,G,60,Inversió nova en infraestructura i béns ús general
2012,G,61,Inversió reposició infraestructura i béns ús gral.
2012,G,62,Inversió nova associada funcionament dels serveis
2012,G,63,Inv.reposició associada funcionament dels serveis
2012,G,64,Despeses en inversions de caràcter immaterial
2012,G,70,Transferències de capital a l'Administració de l'Estat
2012,G,72,Transferències de capital al Servei de salut de les Illes Balears
2012,G,74,Transferències de capital al sector públic instrumental i altres ens sec.púb
2012,G,75,Transferències de capital a comunitats autònomes
2012,G,76,Transferències de capital a corporacions locals
2012,G,77,Transferències de capital a empreses privades
2012,G,78,Transferències de capital a famílies i institucions sense ànim de lucre
2012,G,79,Transferències de capital a l'exterior
2012,G,80,Adquisició de deute del sector públic
2012,G,81,Adquisició d'obligacions i bons de fora sec.públic
2012,G,82,Concessió de préstecs al sector públic
2012,G,83,Concessió de préstecs fora del sector públic
2012,G,84,Constitució de dipòsits i fiances
2012,G,85,Adquisició d'accions i participacions sector públic
2012,G,86,Adquisició d'accions i participacions fora del sector públic
2012,G,87,Aportacions patrimonials
2012,G,90,Amortització de deute públic en euros
2012,G,91,Amortització de préstecs en euros
2012,G,92,Amortització de deute públic en divises
2012,G,93,Amortització de préstecs en divises
2012,G,94,Devolució de dipòsits i fiances
2012,G,100,Retribucions bàsiques i altres remuneracions alts càrrecs
2012,G,107,Aportacions a plans de pensions alts càrrecs
2012,G,110,Retribucions bàsiques i altres remuneracions personal eventual
2012,G,117,Aportacions a plans de pensions personal eventual
2012,G,120,Retribucions bàsiques personal funcionari i estatutari
2012,G,121,Retribucions complementàries personal funcionari i estatutari
2012,G,122,Retribucions en espècie personal funcionari i estatutari
2012,G,123,Indemnitzacions percebudes per destinació fora IB personal funcionari i estatutari
2012,G,124,Retribucions de funcionaris en pràctiques
2012,G,126,Retribucions de funcionaris interins
2012,G,127,Aportacions a plans de pensions personal funcionari i estatutari
2012,G,130,Retribucions personal laboral fix
2012,G,131,Retribucions personal laboral temporal
2012,G,132,Retribucions en espècie personal laboral
2012,G,137,Aportacions a plans de pensions personal laboral
2012,G,141,Retribucions d'altre personal
2012,G,147,Aportacions a plans de pensions altre personal
2012,G,148,Retribucions pendents d'aplicació (Instruc.7/02)
2012,G,149,Retribucions personal pendent d'integració a RLT
2012,G,150,Incentius al rendiment: Productivitat
2012,G,151,Incentius al rendiment: Gratificacions
2012,G,160,Quotes socials
2012,G,161,Prestacions socials
2012,G,162,Despeses socials a favor funcionari i personal no laboral
2012,G,163,Despeses socials a favor del personal laboral
2012,G,200,Arrendaments de terrenys i béns naturals
2012,G,202,Arrendaments d'edificis i d'altres construccions
2012,G,203,Arrendaments maquinària instal·lacions i utillatge
2012,G,204,Arrendaments de material de transport
2012,G,205,Arrendaments de mobiliari i estris
2012,G,206,Arrendaments d'equips per al procés d'informació
2012,G,208,Arrendaments d'altre immobilitzat material
2012,G,209,Cànons
2012,G,210,Reparacions i manteniment d'infraestructura i béns naturals
2012,G,212,Reparacions i manteniment d'edificis i d'altres construccions
2012,G,213,"Reparacions i manteniment de maquinària, instal·lacions i utillatge"
2012,G,214,Reparacions i manteniment de material de transport
2012,G,215,Reparacions i manteniment de mobiliari i estris
2012,G,216,Reparacions i manteniment d'equips per a processos d'informació
2012,G,219,Reparacions i manteniment d'altre immobilitzat material
2012,G,220,Material d'oficina
2012,G,221,Subministraments
2012,G,222,Comunicacions
2012,G,223,Transports
2012,G,224,Primes d'assegurances
2012,G,225,Tributs
2012,G,226,Despeses diverses
2012,G,227,Treballs realitzats per altres empreses i professionals
2012,G,229,Despeses funcionament centres escolars
2012,G,230,"Dietes, locomoció i trasllats"
2012,G,231,Assistències i pernoctes
2012,G,239,Altres indemnitzacions
2012,G,240,Dotació per a serveis nous
2012,G,261,Concerts per a la prestació de serveis socials
2012,G,300,Interessos de deute públic en euros
2012,G,301,"Despeses d'emissió, modificació i cancel·lació de deute públic en euros"
2012,G,309,Altres despeses financeres de deute públic en euros
2012,G,310,Interessos de préstecs en euros
2012,G,311,"Despeses formalització, modificació i cancel·lació de préstecs en euros"
2012,G,319,Altres despeses financeres de préstecs en euros
2012,G,320,Interessos de deute públic en divises
2012,G,321,"Despeses d'emissió, modificació i cancel·lació de deute públic en divises"
2012,G,322,Diferències de canvi
2012,G,329,Altres despeses financeres de deute públic en divises
2012,G,330,Interessos de préstecs en divises
2012,G,331,"Despeses formalització, modificació i cancel·lació de préstecs en divises"
2012,G,339,Altres despeses financeres de préstecs en divises
2012,G,340,Interessos de dipòsits
2012,G,341,Interessos de fiances
2012,G,352,Interessos de demora
2012,G,359,Altres despeses financeres
2012,G,400,Transferències corrents a l'Administració General de l'Estat
2012,G,401,Transferències corrents a organismes autònoms estatals
2012,G,402,Transferències corrents a la Seguretat Social
2012,G,403,Transferències corrents a fundacions estatals
2012,G,404,"Transferències corrents a soc.merc.estatals, ent.empres. i altres ens púb."
2012,G,420,Transferències corrents al Servei de Salut de les Illes Balears
2012,G,440,Transferències corrents a societats mercantils públiques autonòmiques
2012,G,441,Transferències corrents a entitats públiques empresarials i altres ens públics autonòmics
2012,G,442,Transferències corrents a empreses vinculades a la Comunitat Autònoma
2012,G,443,Transferències corrents a consorcis en què participa la Comunitat Autònoma
2012,G,444,Transferències corrents a fundacions del sector públic autonòmic
2012,G,445,Transferències corrents a altres fundacions en què participa la com.aut.
2012,G,446,Subvencions a societats mercantils públiques
2012,G,447,Subvencions a entitats públiques empresarials i altres ens públics
2012,G,448,Subvencions a consorcis en què participa la CAIB
2012,G,449,Subvencions a fundacions del sector públic
2012,G,451,Transferències corrents a altres comunitats autònomes
2012,G,460,Transferències corrents a ajuntaments
2012,G,461,Transferències corrents a consells insulars
2012,G,464,Transferències corrents a empreses públiques i altres ens públics de corporacions locals
2012,G,469,transferències corrents a altres ens territorials
2012,G,470,Transferències corrents a empreses privades
2012,G,480,Transferències corrents a famílies i institucions sense ànim de lucre
2012,G,481,Transferències corrents a centres d'ensenyament concertat
2012,G,490,Transferències corrents a l'exterior
2012,G,500,Fons de contingència
2012,G,600,Inversió nova: terrenys i béns naturals
2012,G,601,Inversió nova: infraestructura i béns destinats a l'ús general
2012,G,608,"Inversió nova: béns del patrimoni històric, artístic i cultural"
2012,G,609,Altres inversions noves
2012,G,610,Inversió de reposició: terrenys i béns naturals
2012,G,611,Inversió de reposició: Infraestructura i béns destinats a l'ús general
2012,G,618,"Inversió de reposició: béns del patrimoni històric, artístic i cultural"
2012,G,619,Altres inversions de reposició
2012,G,620,Inversió nova associada al funcionament dels serveis: terrenys i béns naturals
2012,G,622,Inversió nova associada al fiuncionament dels serveis: edificis i altres construccions
2012,G,623,"Inversió nova associada al funcionament dels serveis: maquinària, instal·lacions i utillatge"
2012,G,624,Inversió nova associada al funcionament dels serveis: elements de transport
2012,G,625,Inversió nova associada al funcionament dels serveis: mobiliari i estris
2012,G,626,Inversió nova associada al funcionament dels serveis: equips per a processos d'informació
2012,G,629,Inversió nova associada al funcionament dels serveis: altre immobilitzat material
2012,G,630,Inv reposició associada al funcionament dels serveis: terrenys i béns naturals
2012,G,632,Inv reposició associada al funcionament dels serveis: edificis i altres construccions
2012,G,633,"Inv reposició associada al funcionament dels serveis: maquinària, instal·lacions i utillatge"
2012,G,634,Inv reposició associada al funcionament dels serveis: elements de transport
2012,G,635,Inv reposició associada al funcionament dels serveis: mobiliari i estris
2012,G,636,Inv reposició associada al funcionament dels serveis: equips per a processos d'informació
2012,G,639,Inv reposició associada al funcionament dels serveis: Altre immobilitzat material
2012,G,640,Despeses en inversions de caràcter immaterial
2012,G,700,Transferències de capital a l'Administració General de l'Estat
2012,G,701,Transferències de capital a organismes autònoms estatals
2012,G,702,Transferències de capital a la Seguretat Social
2012,G,703,Transferències de capital a fundacions estatals
2012,G,704,"Transferències de capital a soc.merc.estatals, ent.empres. i altres ens públ"
2012,G,720,Transferències de capital al Servei de Salut de les Illes Balears
2012,G,740,Transferències de capital a societats mercantils públiques
2012,G,741,Transferències de capital a entitats públiques empresarials i altres ens púb
2012,G,742,Transferències de capital a empreses vinculades a la Comunitat Autònoma
2012,G,743,Transferències de capital a consorcis en què participa la Comunitat Autònoma
2012,G,744,Transferències de capital a fundacions del sector públic autonòmic
2012,G,745,Transferències de capital a altres fundacions en què participi la com.aut.
2012,G,746,Subvencions a societats mercantils públiques
2012,G,747,Subvencions entitats públiques empresarials i altres ens públics
2012,G,748,Subvencions a consorcis en què participa la CAIB
2012,G,749,Subvencions a fundacions del sector públic
2012,G,750,Transferències a la Comunitat Autònoma de les Illes Balears
2012,G,751,Transferències a altres comunitats autònomes
2012,G,760,Transferències de capital a ajuntaments
2012,G,761,Transferències de capital a consells insulars
2012,G,764,Transferències de capital a empreses públiques i altres ens de corp.locals
2012,G,769,Transferències de capital a altres ens territorials
2012,G,770,Transferències de capital a empreses privades
2012,G,780,Transferències de capital a famílies i institucions sense ànim de lucre
2012,G,781,Transferències de capital a centres d'ensenyament concertat
2012,G,790,Transferències de capital a l'exterior
2012,G,800,Adquisició de deute del sector públic a curt termini
2012,G,801,Adquisició de deute del sector públic a llarg termini
2012,G,810,Adquisició d'obligacions a curt termini
2012,G,811,Adquisició d'obligacions a llarg termini
2012,G,820,Concessions de préstecs al sector públic a curt termini
2012,G,821,Concessions de préstecs al sector públic a llarg termini
2012,G,830,Concessions de préstecs fora del sector públic a curt termini
2012,G,831,Concessions de préstecs fora del sector públic a llarg termini
2012,G,840,Constitució de dipòsits
2012,G,841,Constitució de fiances
2012,G,850,Adquisició accions i participacions sector públic estatal
2012,G,851,Adquisició accions i participacions sector públic de la CAIB
2012,G,852,Adquisició accions i participacions del sector públic d'altres comunitats autònomes
2012,G,853,Adquisició accions i participacions del sector públic de corporacions locals
2012,G,860,Adquisició accions i participacions fora sector públic d'empreses nacionals o de la UE
2012,G,861,Adquisició accions i participacions fora sector públic d'altres empreses
2012,G,870,Aportacions patrimonials a entitats públiques empresarials
2012,G,871,Aportacions patrimonials a societats mercantils públiques
2012,G,872,Aportacions patrimonials a fundacions públiques CAIB
2012,G,873,Aportacions patrimonials a consorcis
2012,G,874,Aportacions patrimonials a l'IB-SALUT
2012,G,900,Amortització de deute públic en euros a curt termini
2012,G,901,Amortització de deute públic en euros a llarg termini
2012,G,910,Amortització de préstecs a curt termini d'ens del sector públic
2012,G,911,Amortització de préstecs llarg termini d'ens del sector públic
2012,G,912,Amortització préstecs curt termini ens fora sector públic
2012,G,913,Amortització préstecs llarg termini ens fora sector públic
2012,G,920,Amortització deute públic en divises a curt termin
2012,G,921,Amortització de deute públic en divises a llarg termini
2012,G,930,Amortització de préstecs en divises a curt termini
2012,G,931,Amortització de préstecs en divises a llarg termin
2012,G,940,Devolució de dipòsits
2012,G,941,Devolució de fiances
2012,G,10000,Retribucions bàsiques d'alts càrrecs
2012,G,10001,Altres remuneracions d'alts càrrecs
2012,G,10002,Triennis d'alts càrrecs
2012,G,11000,Retribucions bàsiques del personal eventual
2012,G,11001,Altres remuneracions del personal eventual
2012,G,11002,Triennis del personal eventual
2012,G,12000,Sous del subgrup A1
2012,G,12001,Sous del subgrup A2
2012,G,12002,Sous del subgrup C1
2012,G,12003,Sous del subgrup C2
2012,G,12004,Sous d'agrupacions professionals
2012,G,12005,Triennis
2012,G,12009,Altres retribucions bàsiques
2012,G,12100,Complement de destinació
2012,G,12101,Complement específic
2012,G,12102,Complement de productivitat compensada
2012,G,12103,Indemnització per residència
2012,G,12119,A Compte carrera i desenv. prof. pers. func.
2012,G,12121,Compl. específic docent complementari per formació
2012,G,12199,Altres complements
2012,G,12200,Casa habitatge
2012,G,12201,Vestuari
2012,G,12202,Bonificacions
2012,G,12209,Altres
2012,G,12300,Indemnitzacions per destinació a l'estranger
2012,G,12301,Indemnitzacions per destinació a altres territoris
2012,G,12302,Indemnitzacions per educació
2012,G,12600,Retribucions de funcionaris interins
2012,G,13000,Retribucions bàsiques
2012,G,13001,Complement de conveni
2012,G,13002,Complement de compensació de costos d'insularitat
2012,G,13004,Complement específic
2012,G,13005,Triennis
2012,G,13006,Complement de torns rotatius
2012,G,13009,Altres complements
2012,G,13019,A Compte carrera i desenv. prof. pers. laboral
2012,G,13100,Retribucions del personal laboral temporal
2012,G,13107,Retribucions Personal Estabilitat Laboral
2012,G,13200,Casa habitatge
2012,G,13201,Vestuari
2012,G,13202,Bonificacions
2012,G,13209,Altres
2012,G,14100,Retribucions d'altre personal
2012,G,14800,Retribucions pendents d'aplicació (Instruc.7/02)
2012,G,14900,Retrib.personal transferit pendent integració RLT
2012,G,15000,Productivitat
2012,G,15100,Gratificacions
2012,G,16000,Seguretat social
2012,G,16009,Altres quotes socials
2012,G,16100,Pensions a funcionaris a càrrec de la CAIB
2012,G,16101,Pensions a famílies a càrrec de la CAIB
2012,G,16109,Altres prestacions socials
2012,G,16200,Formació i perfeccionament del personal
2012,G,16201,Economats i menjadors
2012,G,16202,Transport de personal
2012,G,16204,Acció social
2012,G,16205,Assegurances
2012,G,16209,Altres despeses socials
2012,G,16300,Formació i perfeccionament del personal
2012,G,16301,Economats i menjadors
2012,G,16302,Transport de personal
2012,G,16304,Acció social
2012,G,16305,Assegurances
2012,G,16309,Altres despeses socials
2012,G,20000,Arrendaments de terrenys i béns naturals
2012,G,20200,Arrendaments d'edificis i d'altres construccions
2012,G,20300,Arrendaments maquinària instal·lacions i utillatge
2012,G,20400,Arrendaments de material de transport
2012,G,20500,Arrendaments de mobiliari i estris
2012,G,20600,Arrendaments d'equips per al procés d'informació
2012,G,20800,Arrendaments d'altre immobilitzat material
2012,G,20900,Cànons
2012,G,21000,D'infraestructura i béns naturals
2012,G,21200,D'edificis i d'altres construccions
2012,G,21300,Reparacions de maquinària i utillatge
2012,G,21301,Repar. d'instal·lacions tècniques i altres inst.
2012,G,21400,De material de transport
2012,G,21500,De mobiliari i estris
2012,G,21600,D'equips per a processos d'informació
2012,G,21900,D'altre immobilitzat material
2012,G,22000,Ordinari no inventariable
2012,G,22001,"Premsa, revistes i altres publicacions"
2012,G,22002,Material informàtic no inventariable
2012,G,22009,Altre material d'oficina
2012,G,22100,Energia elèctrica
2012,G,22101,Aigua
2012,G,22102,Gas
2012,G,22103,Combustibles
2012,G,22104,Vestuari
2012,G,22105,Productes alimentaris
2012,G,22106,Productes farmacèutics i material sanitari
2012,G,22108,"Material esportiu, didàctic i cultural"
2012,G,22109,Altres subministraments
2012,G,22200,Telefòniques
2012,G,22209,Altres comunicacions
2012,G,22300,Transports
2012,G,22400,Primes d'assegurances
2012,G,22500,Tributs estatals
2012,G,22501,Tributs autonòmics
2012,G,22502,Tributs locals
2012,G,22601,Atencions protocol·làries i de representació
2012,G,22602,Publicitat i propaganda
2012,G,22603,Despeses jurídiques i contencioses
2012,G,22606,"Reunions, conferències i cursos"
2012,G,22607,Oposicions i proves selectives
2012,G,22609,Altres despeses diverses
2012,G,22700,Neteja i endreçament
2012,G,22701,Seguretat
2012,G,22702,Valoracions i peritatges
2012,G,22703,Postals
2012,G,22704,"Custòdia, dipòsit i emmagatzematge"
2012,G,22705,Processos electorals
2012,G,22706,Estudis i treballs tècnics
2012,G,22708,Serveis de recaptació
2012,G,22709,Altres treballs
2012,G,22900,Despeses funcionament centres escolars
2012,G,22901,Despeses funcionament de l'Escola S de Disseny
2012,G,23000,Dietes
2012,G,23001,Locomoció
2012,G,23002,Trasllats
2012,G,23009,Altres indemnitzacions per raó del servei
2012,G,23100,Assistències i pernoctes
2012,G,23900,Altres indemnitzacions
2012,G,24000,Dotació per a serveis nous
2012,G,24001,"Despeses transitóries extinció CAIB Patrimoni, SA"
2012,G,26104,Concerts de serveis socials amb altres instit.
2012,G,30000,Interessos
2012,G,30003,"Interessos, emissions d'obligacions 2005"
2012,G,30004,"Interessos, emissions d'obligacions 2009"
2012,G,30005,"Interessos, emissions d'obligacions 2010"
2012,G,30006,"Interessos, emissions d'obligacions 2011"
2012,G,30007,"Interessos, emissions d'obligacions 2012"
2012,G,30100,"Despeses d'emissió, modificació i cancel·lació"
2012,G,30900,Altres despeses financeres
2012,G,31000,Interessos de préstecs amb entitats de crèdit
2012,G,31009,Interessos de préstecs c/t amb entitats de crèdit
2012,G,31090,Interessos altres préstecs amb entitats de crèdit
2012,G,31100,"Despeses formalització, modificació i cancel·lació"
2012,G,31900,Altres despeses financeres
2012,G,32000,Interessos
2012,G,32100,"Despeses d'emissió, modificació i cancel·lació"
2012,G,32200,Diferències de canvi
2012,G,32900,Altres despeses financeres
2012,G,33000,Interessos préstecs divises amb entitats de crèdit
2012,G,33100,"Despeses formalització, modificació i cancel·lació"
2012,G,33900,Altres despeses financeres
2012,G,34000,Interessos de dipòsits
2012,G,34100,Interessos de fiances
2012,G,35200,Interessos de demora
2012,G,35900,Altres despeses financeres
2012,G,35980,Despeses financeres per cessió de crèdit
2012,G,35990,Interessos arrend.financer opció compra (leasing)
2012,G,40000,A l'Administració General
2012,G,40100,A organismes autònoms
2012,G,40200,A la Seguretat Social
2012,G,40400,"A soc.merc.estatals, ent.empres. i altres ens púb."
2012,G,42001,Transf. al Servei de Salut de les Illes Balears
2012,G,42002,Subv. al Servei de Salut de les Illes Balears
2012,G,44000,Transferències a societats mercantils públiques
2012,G,44014,Transf.Gestió Emergències de les Illes Balears SA
2012,G,44015,Transferència a Multimèdia de les Illes Balears SA
2012,G,44100,A entitats públiques empresarials i altres ens púb
2012,G,44101,A l'Agència de Turisme de les Illes Balears
2012,G,44103,A l'Institut Balear de l'Habitatge
2012,G,44104,A Serveis Ferroviaris de Mallorca
2012,G,44111,A l'Institut Balear de la Natura
2012,G,44112,A l'Institut d'Innovació Empresarial de les Illes
2012,G,44113,A la Universitat de les Illes Balears
2012,G,44114,A l'Institut d'Infraestructures i Serv.Educatius
2012,G,44116,A Radiotelevisió de les Illes Balears
2012,G,44117,Al Fons de Garantia Agrària i Pesquera de les IB
2012,G,44118,A l'Ag. Balear de l' Aigua i la Qualitat Ambiental
2012,G,44119,A Ports de les Illes Balears
2012,G,44121,A l'Institut Balear de la Joventut
2012,G,44123,"UIB, complements retributius addicionals"
2012,G,44127,Al Consorci de Transports de Mallorca
2012,G,44129,A Serveis de Millora Agrària
2012,G,44130,A Serveis Informació Territorial Illes Balears
2012,G,44133,A la UIB: implantació estudis de grau de Medicina
2012,G,44150,A l'Agència Tributària de les Illes Balears
2012,G,44200,A empreses vinculades a la Comunitat Autònoma
2012,G,44202,"A ISBA, SGR"
2012,G,44204,"A Carn Illa, SA"
2012,G,44205,"Gestión Urbanística de Baleares, SA"
2012,G,44300,A consorcis en què participa la Comunitat Autònoma
2012,G,44301,Consorci de Transports de Mallorca
2012,G,44302,Centre Balears Europa
2012,G,44320,"Al Cons. Música Illes Balears ""Orquestra Simfònica"
2012,G,44323,Al Consorci per a la protecció i acollida de minus
2012,G,44326,Escola d'Hoteleria
2012,G,44339,Al Fons Mallorquí de Solidaritat i Cooperació
2012,G,44340,Institut d'Estudis Baleàrics
2012,G,44341,Institut Ramon Llull
